titulo,coordenada,calificacion,comentario
Alma Cocina Viva,"-12.1220962,-77.0310092,17z",4,Pedimos platos a la carta: salmón y carne a la parrilla. Los platos estuvieron exquisitos. El ambiente es agradable y familiar. Ayer Domingo había música criolla. Lo único por mejorar es que los platos demoraron pero nos habían avisado de…
Alma Cocina Viva,"-12.1220962,-77.0310092,17z",4,"Buen ambiente, buenos insumos. Podrían mejorar la atención y la variedad de los platos en el buffet criollo."
Alma Cocina Viva,"-12.1220962,-77.0310092,17z",5,"El sitio es super lindo, tranquilo y muy buena atención. La comida muy rica en especial la lasaña y el lomo saltado. Recomendado."
Alma Cocina Viva,"-12.1220962,-77.0310092,17z",5,"100% recomendable. Lo único que se debe tener en cuenta es que se trata del restaurante del hotel en donde se sirve el desayuno y almuerzo buffet y por la noche cena a la carta. La comida, los cócteles, la atención y los precios todo muy bueno"
Alma Cocina Viva,"-12.1220962,-77.0310092,17z",3,Bonito lugar y variedad de opciones; sin embargo pedí huevos benedictinos pero solo me dieron pan con huevo y un poco de yema (sin salsa holandesa) además que los omeletes parecían una tortilla doblada; me decepcioné puesto que tenia muchas…
Alma Cocina Viva,"-12.1220962,-77.0310092,17z",4,"Acudí al almuerzo criollo buffet por el día de la madre. Las entradas eran papa a la huancaína y Ocopa. Había poca variedad de verduras (lechugas, tomate, pepino, zanahoria, zucchini y berenjena a la parrilla)…"
Alma Cocina Viva,"-12.1220962,-77.0310092,17z",3,"Lo único para salvar de este bufete es la barra de ceviches, leches de tigre y tiraditos (todo delicioso)…  el arroz con mariscos y la barra de comida criolla son feos, nada qué ver, sólo ofrecen cara pulcra, sopa seca, un tallarín marrón,…"
Alma Cocina Viva,"-12.1220962,-77.0310092,17z",3,"Tuve mucha espectativa para este lugar , decian que preparaban huevos Benedictinos , iba para probar eso y el chicharron , pero lamentable fue cuando llegaron , la presentación del plato estuvo bonita , pero no tenia la salsa holandesa que…"
Alma Cocina Viva,"-12.1220962,-77.0310092,17z",5,Lo mejor el tea time!
Alma Cocina Viva,"-12.1220962,-77.0310092,17z",5,"Roxana nos atendió excelente súper amable, proactiva, no nos podemos quejar de su atención ni de la comida. Fue el buffet tea. El ambiente muy relax tranquilo para una buena charla. Todas quedamos encantadas con la atención y la comida en variedad opciones. Para personas vegetarianas , veganas y carnívoras el último caso como yo"
Alma Cocina Viva,"-12.1220962,-77.0310092,17z",5,"Muy buen restaurante!! Ofrecen un desayuno buffet muy rico y variado, en el buffett del almuerzo también existe variedad, además de contar con un excelente servicio. Muy recomendado."
Alma Cocina Viva,"-12.1220962,-77.0310092,17z",5,"Muy buena atención, todo muy rico.  El buffet del tea time  muy recomendado."
Alma Cocina Viva,"-12.1220962,-77.0310092,17z",3,"Para desayuno buffet, la atención no es a la mesa, debes pararte y con mascarilla ir a servirte no obstante para algunos pedidos el personal está atento 6/10. Sólo 2 tipos de jugos frescos, 4 tipos de fruta y 3 sabores de yogurt 5/10. Los…"
Alma Cocina Viva,"-12.1220962,-77.0310092,17z",5,"Excelente servicio, comida de primera y espacio elegante, calmo y atractivo. Totalmente recomendable y para repetir la experiencia."
Alma Cocina Viva,"-12.1220962,-77.0310092,17z",5,Bonita experiencia para cenar con la familia
Alma Cocina Viva,"-12.1220962,-77.0310092,17z",4,"Variedad de opciones, lo único malo que los contenedores donde ponen los panqueques no los mantienen calientes, y me tocó un pedazo de papaya malogrado. La atención del mozo (Jorge) y de todo el personal muy buena. Definitivamente volvería!!"
Alma Cocina Viva,"-12.1220962,-77.0310092,17z",1,"Pésimo, para lo que cobran tienen una variedad barata de baja calidad"
Alma Cocina Viva,"-12.1220962,-77.0310092,17z",5,"Me gusto  todo, la atención y las instalaciones."
Alma Cocina Viva,"-12.1220962,-77.0310092,17z",1,"La comida mediocre, chicha de sobre y el pescado barato.. no regreso."
Alma Cocina Viva,"-12.1220962,-77.0310092,17z",5,"Muy buen ambiente, me encanta que tengan opciones veganas en un buffett tan surtido. El trato del personal es A1. Definitivamente lo recomiendo."
Alma Cocina Viva,"-12.1220962,-77.0310092,17z",4,"Me he hospedado en el hotel en algunas oportunidades y la comida es buena. Los desayunos son buffet , tienen opciones criollas , variedad de panes, fruta. En los almuerzos y cenas , los platos son adecuados, se cuidan los detalles y porciones acorde con el formato. El servicio muy bueno."
Alma Cocina Viva,"-12.1220962,-77.0310092,17z",4,"Es de ambiente agradable y serio ,la comida está apetitosa, no es el mejor lugar al que he ido pero es un lugar donde no puedes perder."
Alma Cocina Viva,"-12.1220962,-77.0310092,17z",3,"Ya no veo variedad a pesar que ya no hay promociones de 2 x 1 en en desayuno buffet,  se paga a precio  normal pero la calidad debería ser la misma espero mejore porq el lugar es muy acogedor a mi me encanta."
Alma Cocina Viva,"-12.1220962,-77.0310092,17z",2,"Fatal, pésimo servicio. La espera fue  interminable y no había gente ????
Hubieron 2 vasijas despostilladas? Milanes algo duras. La verdad hay mucho que mejorar y en quien se encarga de estos temas."
Alma Cocina Viva,"-12.1220962,-77.0310092,17z",5,"Hermoso lugar, y la atención espectacular! Definitivamente recomendable!"
Alma Cocina Viva,"-12.1220962,-77.0310092,17z",4,Muy bueno
Alma Cocina Viva,"-12.1220962,-77.0310092,17z",5,Uno de los.mejores sitios. Buena atención. El gerente pasa mesa por mesa para preguntar si todo está bien.
Alma Cocina Viva,"-12.1220962,-77.0310092,17z",5,"Muy buen tea time, a pesar de que no tiene una gran variedad de tes, ni de helados. Todo lo presentado se ve muy bien y es muy rico."
Alma Cocina Viva,"-12.1220962,-77.0310092,17z",5,"Me encanta el lugar tan acogedor, la calidad del producto y buen servicio que se les brinda a cada uno. Definitivamente recomendable. Gracias Jamely y Eduardo por la buena atención."
Alma Cocina Viva,"-12.1220962,-77.0310092,17z",5,"Me encantó, muy buena atención, súper amables, el Buffet estuvo sensacional"
