titulo,coordenada,calificacion,comentario
D'Garden Restaurant cevicheria,"-12.0773039,-77.1696105,11z",4,La comida es buena pero el local es pequeño por eso demoran bastante en traer la comida
D'Garden Restaurant cevicheria,"-12.0773039,-77.1696105,11z",5,Excelente comida volveré muchas veces
D'Garden Restaurant cevicheria,"-12.0773039,-77.1696105,11z",5,Un buen Restaurante y excelente  la calidad  de la comida
D'Garden Restaurant cevicheria,"-12.0773039,-77.1696105,11z",5,"Estuvo deliciosa la comida criolla, es un lugar pequeño, recomiendo acudir temprano para encontrar lugar disponible. Decirle al cheff que le faltó cocción a los fideos."
D'Garden Restaurant cevicheria,"-12.0773039,-77.1696105,11z",5,"Excelente ambiente, comida agradable, buena atención"
D'Garden Restaurant cevicheria,"-12.0773039,-77.1696105,11z",5,"Me gusta mucho, es agradable,  lo mejor de chorrillos"
D'Garden Restaurant cevicheria,"-12.0773039,-77.1696105,11z",4,Buena comida variedad los platos son variados lo que no me gustó que la atención no es muy rápida
D'Garden Restaurant cevicheria,"-12.0773039,-77.1696105,11z",5,Excelente comida muy cómodo y buena atención recomendado 👍🤙…
D'Garden Restaurant cevicheria,"-12.0773039,-77.1696105,11z",5,Excelente platos en cantidad y calidad
D'Garden Restaurant cevicheria,"-12.0773039,-77.1696105,11z",5,Deliciosa comida criolla en un lugar fresco limpio y agradable. Buen provecho...
D'Garden Restaurant cevicheria,"-12.0773039,-77.1696105,11z",3,Agradable  lugar y se come  bien la atención  es buena
D'Garden Restaurant cevicheria,"-12.0773039,-77.1696105,11z",5,"Yo como Padre de mi PRINCESITA Carisa  que es una preciosa niña  y le gusta el  Ceviche  y los Mariscos, chicharrón  de Pescado  hoy quiero  celebrar  mi cumpleaños  ,que mejor D'GARDEN , PARA DISFRUTAR  al delicioso  y muy Rico  se los recomiendo  ."
D'Garden Restaurant cevicheria,"-12.0773039,-77.1696105,11z",5,"Platos con un delicioso sabor y muy acogedor, recomendable para la familia"
D'Garden Restaurant cevicheria,"-12.0773039,-77.1696105,11z",1,"Mala atención, no tienen buena sazón, los precios no justifican ni lavanda ni la calidad de los platos.... no vayan de verdad...."
D'Garden Restaurant cevicheria,"-12.0773039,-77.1696105,11z",4,"Buenos platos y la cantidad adecuada,el sabor es bueno."
D'Garden Restaurant cevicheria,"-12.0773039,-77.1696105,11z",4,"Muy buena comida ,demoran en la atención"
D'Garden Restaurant cevicheria,"-12.0773039,-77.1696105,11z",5,Bien acogedor y privacidad..
D'Garden Restaurant cevicheria,"-12.0773039,-77.1696105,11z",4,"Excelente calidad de los platos q ofrece, falta un poco de rapidez en la atención y falta de stock en gaseosas"
D'Garden Restaurant cevicheria,"-12.0773039,-77.1696105,11z",4,"excelente lugar, buena la atencion los platos son variados pero  no  es su fuerte los mariscos"
D'Garden Restaurant cevicheria,"-12.0773039,-77.1696105,11z",2,Buena atención pero platos caros y no tienen buena sazón. Dejan mucho que desear.
D'Garden Restaurant cevicheria,"-12.0773039,-77.1696105,11z",4,Su comida es muy rica y lindo lugar para disfrutar mi almuerzo
D'Garden Restaurant cevicheria,"-12.0773039,-77.1696105,11z",1,Se demoran en atender y no cumplen los platos han bajado de calidad y cantidad solo subeel precio
D'Garden Restaurant cevicheria,"-12.0773039,-77.1696105,11z",5,"El lugar es muy agradable , la comida deliciosa me encantó 😀🍛🍜🍝🍤🍕🍟🍔🍲…"
D'Garden Restaurant cevicheria,"-12.0773039,-77.1696105,11z",5,Buena atención. Buena comida... lo mejor de la zona...
D'Garden Restaurant cevicheria,"-12.0773039,-77.1696105,11z",5,"Buen lugar para compartir con la familia, buena sazón y excelentes precios.
Exquisito cabrito a la norteña, con antesala de un buen cebiche."
D'Garden Restaurant cevicheria,"-12.0773039,-77.1696105,11z",3,Buena atención aunque demora mucho...
D'Garden Restaurant cevicheria,"-12.0773039,-77.1696105,11z",5,Excelente ambiente fresco muy limpio y exquisita comida
D'Garden Restaurant cevicheria,"-12.0773039,-77.1696105,11z",5,Muy buena la comida.
D'Garden Restaurant cevicheria,"-12.0773039,-77.1696105,11z",2,"Refresco caliente, demora en la atención, sin gusto la comida . No era así bajo el servicio."
D'Garden Restaurant cevicheria,"-12.0773039,-77.1696105,11z",1,"Una desgracia en la atención,  comida pésima se demoran demasiado en atender"
D'Garden Restaurant cevicheria,"-12.0773039,-77.1696105,11z",5,La. Comida muy rica buena atencion
D'Garden Restaurant cevicheria,"-12.0773039,-77.1696105,11z",4,"Muy rico, buen precio."
D'Garden Restaurant cevicheria,"-12.0773039,-77.1696105,11z",4,Buena carta.. buena atención... Agradable local
D'Garden Restaurant cevicheria,"-12.0773039,-77.1696105,11z",5,Todo rico y a tiempo
D'Garden Restaurant cevicheria,"-12.0773039,-77.1696105,11z",5,Buena comida un buen lugar para pasarla en familia
D'Garden Restaurant cevicheria,"-12.0773039,-77.1696105,11z",4,Los platos son ricos y el lugar es agradable.
D'Garden Restaurant cevicheria,"-12.0773039,-77.1696105,11z",5,Buen point para comer tus gustitos. Chévere
D'Garden Restaurant cevicheria,"-12.0773039,-77.1696105,11z",4,Delicioso. Y el precio justo
D'Garden Restaurant cevicheria,"-12.0773039,-77.1696105,11z",3,Los platos a la carta son muy buenos también.
D'Garden Restaurant cevicheria,"-12.0773039,-77.1696105,11z",5,"Muy delicioso , chupe de camaron."
D'Garden Restaurant cevicheria,"-12.0773039,-77.1696105,11z",5,Todo muy rico
D'Garden Restaurant cevicheria,"-12.0773039,-77.1696105,11z",1,Pesima atención se demoran mucho en servir
D'Garden Restaurant cevicheria,"-12.0773039,-77.1696105,11z",4,Muy buen arroz con pato!
D'Garden Restaurant cevicheria,"-12.0773039,-77.1696105,11z",5,Muy buena la sazón.
D'Garden Restaurant cevicheria,"-12.0773039,-77.1696105,11z",5,Les recomiendo
D'Garden Restaurant cevicheria,"-12.0773039,-77.1696105,11z",4,"Una buena sason, y buenos platos"
D'Garden Restaurant cevicheria,"-12.0773039,-77.1696105,11z",5,Muy bueno
D'Garden Restaurant cevicheria,"-12.0773039,-77.1696105,11z",5,La comida es bien casera
D'Garden Restaurant cevicheria,"-12.0773039,-77.1696105,11z",5,Estuvo bueno el almuerzo de hoy
D'Garden Restaurant cevicheria,"-12.0773039,-77.1696105,11z",4,Estuvo bueno
D'Garden Restaurant cevicheria,"-12.0773039,-77.1696105,11z",5,Muy bueno
D'Garden Restaurant cevicheria,"-12.0773039,-77.1696105,11z",4,Su leche de tigre es buenaza
D'Garden Restaurant cevicheria,"-12.0773039,-77.1696105,11z",5,Ed un buem restaurante :_)
D'Garden Restaurant cevicheria,"-12.0773039,-77.1696105,11z",4,Un menú agradable
D'Garden Restaurant cevicheria,"-12.0773039,-77.1696105,11z",4,Comida rica y platos contundentes.
D'Garden Restaurant cevicheria,"-12.0773039,-77.1696105,11z",5,Buena sazón!
D'Garden Restaurant cevicheria,"-12.0773039,-77.1696105,11z",5,Excelente servicio
D'Garden Restaurant cevicheria,"-12.0773039,-77.1696105,11z",5,Buenazo
D'Garden Restaurant cevicheria,"-12.0773039,-77.1696105,11z",4,Buena comida
D'Garden Restaurant cevicheria,"-12.0773039,-77.1696105,11z",5,100% recomendadisimo
D'Garden Restaurant cevicheria,"-12.0773039,-77.1696105,11z",1,La verdad... Pésimo
D'Garden Restaurant cevicheria,"-12.0773039,-77.1696105,11z",5,Lindo
D'Garden Restaurant cevicheria,"-12.0773039,-77.1696105,11z",4,Rico
D'Garden Restaurant cevicheria,"-12.0773039,-77.1696105,11z",5,Bueno
D'Garden Restaurant cevicheria,"-12.0773039,-77.1696105,11z",4,Comida agradable
D'Garden Restaurant cevicheria,"-12.0773039,-77.1696105,11z",4,Rica comida
