titulo,coordenada,calificacion,comentario
El Mexicano Tacos & Burritos,"-12.1220962,-77.0310092,17z",4,"El lugar es muy agradable. Decorado al estilo mexicano
Tomamos el servicio Eat all you can x 45 soles adultos y 25 soles niños. Incluyw bebida ilimitada (agua de jamaica) y todo lo que desees de la carta. Fui con la…"
El Mexicano Tacos & Burritos,"-12.1220962,-77.0310092,17z",3,"Atención excelente de parte de la mesera y la comida estaba deliciosa. Pero todo en contraste con la entrada, no nos recibió nadie y tuvimos que sugerir que nos atiendan, pésimo control de protocolos"
El Mexicano Tacos & Burritos,"-12.1220962,-77.0310092,17z",4,"Los burritos son deliciosos, pero la tortilla de tacos no tiene buen sabor. Los rellenos son agradables pero no extraordinarios. La barra libre es una MUY buena opción para los hambrientos. Buena atención del personal."
El Mexicano Tacos & Burritos,"-12.1220962,-77.0310092,17z",4,"Comida buena, no wow pero buena, deberian ser menos las porciones de barra libre, y para ser un local de 4 mesas la atencion no es lo que se espera, la chica se quedaba mucho tiempo en la barra de cocina en vez de estar pendiente de las mesas"
El Mexicano Tacos & Burritos,"-12.1220962,-77.0310092,17z",1,"Son 2 ocasiones en que el trato al cliente ha sido pésimo, la primera vez me miraron de arriba abajo con un gesto de desdén al momento de ingresar, la segunda me negaron la atención al pedir una barra libre pese a que previamente me habían…"
El Mexicano Tacos & Burritos,"-12.1220962,-77.0310092,17z",3,"El local y atención son buenas .
Precio de la barra libre regular solo con una bebida es gratis la barra las demás pagas un extra.…"
El Mexicano Tacos & Burritos,"-12.1220962,-77.0310092,17z",5,"El chingon es delicioso. Preguntar antes si tienen cochinita pibil porque rara vez tienen!! Pero cuando hay, sí o sí paso por ahí 😁…"
El Mexicano Tacos & Burritos,"-12.1220962,-77.0310092,17z",5,"Lindo lugar, pero muy chiquito, hay que llegar temprano para encontrar mesa porque se llena. Igual me he enterado que van a abrir un local más grande en la cuadra 37 de la Benavides ¡Bien por eso! Te atienden de primera y la comida,…"
El Mexicano Tacos & Burritos,"-12.1220962,-77.0310092,17z",4,"Me encanta el lugar, con buena opción para vegetarianos, verduras y hongos. Recomiendo tomar el jugo de Jamaica. Tienen una opción de barra libre a 45 soles y comes y bebés todo lo que quieras solo que si no terminas el último plato que…"
El Mexicano Tacos & Burritos,"-12.1220962,-77.0310092,17z",2,"El lugar es muy pequeño, llegué a la 1 p.m. y los trabajadores no me hicieron mucho caso, se demoraron en atenderme 20 Min y en traer el primer plato unos 20 Min más porque pedí el all you can eat, me tuve que servir sola las salsas porque…"
El Mexicano Tacos & Burritos,"-12.1220962,-77.0310092,17z",1,"Se llaman restaurante mexicano y su ají no pica en lo absoluto, las tortillas muy sosas y el baño deja mucho que desear. Lo único rescatable es la atención -muy educado el muchacho que me atendió- y la bebida estuvo aceptable."
El Mexicano Tacos & Burritos,"-12.1220962,-77.0310092,17z",3,"Comida sin sabor y muy salada.  No vale la pena el all you can eat, tampoco vale la pena comprar tacos por carta, sale muy caro, el mismo sabor salado en todos los platos, nada que ver con los verdaderos tacos mexicanos, decepción el taco al pastor. El agua de Jamaica sí estaba rica y el servicio fue bueno. El local muy pequeño."
El Mexicano Tacos & Burritos,"-12.1220962,-77.0310092,17z",3,"Lugar pequeño, no me encantaron sus presentaciones, solo tienen bebida de jamaica y gaseosas, está bien como para probar comida mexicana."
El Mexicano Tacos & Burritos,"-12.1220962,-77.0310092,17z",2,En las fotos de Rappi se ve exageradamente mucho mejor las opciones de su menú de lo que verdaderamente llega. A mi me tocó frío y esperaba más cantidad. No está lejos de casa como para que haya llegado con una temperatura que no es la…
El Mexicano Tacos & Burritos,"-12.1220962,-77.0310092,17z",1,"El local de. Benavides muy bonito, la atención pésima, fuimos 5amigos estuvimos un hora y veinte minutos afuera, primera vez que fuimos, no había donde sentarse afuera, y llovisnando, a nadie le importaba, por fin entramos esperamos como 15…"
El Mexicano Tacos & Burritos,"-12.1220962,-77.0310092,17z",5,"Muy buena atencion, nos toco una señorita muy amable la cual no recomendo buenas opciones, el lugar es bonito y comodo. El sabor es muy bueno, les recomiendo las Quesadillas Tex o unas Gringas al pastor, tienen estacionamiento para 4 autos…"
El Mexicano Tacos & Burritos,"-12.1220962,-77.0310092,17z",5,"Gran variedad de tacos, todos muy ricos y la atención es de primera. El espacio es bastante reducido, pero con la buena atención y la comida, realmente no es un problema. El precio tampoco es elevado como para exigir un mejor espacio, con la buena comida y atención es más que suficiente."
El Mexicano Tacos & Burritos,"-12.1220962,-77.0310092,17z",5,"Riquísimo y la atención A1. Fui un lunes por la tarde cuando el local estaba con pocos clientes y pedí el All you can eat y practicamente armas tu plato: escoges la opción de plato (sea taco, burrito, quesadilla, etc) y luego la opción de…"
El Mexicano Tacos & Burritos,"-12.1220962,-77.0310092,17z",5,"Muy bien lugar para probar comida mexicana se siente el sabor un poco fuerte, se debe de tener en cuenta que la comida Mexicana y Texana se considera por ser bien condimentada pero con muy bien sabor.…"
El Mexicano Tacos & Burritos,"-12.1220962,-77.0310092,17z",3,Es una buena oportunidad de acercarse a la comida mexicana. Los tacos no son tan iguales a los que uno Encuentra en México. Las aguas de Jamaica si son lo destacado pq no es comun ese sabor. Los precios son 25 soles por persona. Y el local es algo chico. Pero la atencion si es amena.. Vale la pena ir.
El Mexicano Tacos & Burritos,"-12.1220962,-77.0310092,17z",3,"Lugar pequeño pero acogedor, me gustaron más los tacos y las bebidas, buen lugar para los que les gusta la comida mexicana, también cuenta con opción de buffet."
El Mexicano Tacos & Burritos,"-12.1220962,-77.0310092,17z",3,"El lugar es de verdad pequeño, tuvimos que esperar más de una hora para coger mesa, la ambientación es buena, la comida cumple sin ser notable, pedimos barra libre y no lo volveremos a hacer, para aquellos que buscan opciones de comida ligera vayan a otro lado, la comida mexicana es bien condimentada."
El Mexicano Tacos & Burritos,"-12.1220962,-77.0310092,17z",1,"Se demoraron muchísimo en dar la orden aprox 1 hora, la comida no nos gustó, el arroz del blow chingon estaba mal cocido, falto de sabor :/ la enchilada trio parecía más un entrada, no compensa para nada el tiempo de espera y el precio"
El Mexicano Tacos & Burritos,"-12.1220962,-77.0310092,17z",5,"Pasa lleno y debes ir temprano para conseguir mesa o demorarás en ser atendido.
La comida es muy buena y hay opciones Texmex.
La barra libre no es tan buena opción ya que con 2 platos ya estas lleno."
El Mexicano Tacos & Burritos,"-12.1220962,-77.0310092,17z",1,"Mucho ruido y pocas nueces. Fui por que escuche hablar de este lugar; pedi su bowl chingon y el plato era 60% arroz, 10% carne, 10% queso y guacamole, 10% nachos y 10% frejoles. La verdad no me parecio un plato agradable y ademas te restringen las salsas a que solo puedes tomar 2"
El Mexicano Tacos & Burritos,"-12.1220962,-77.0310092,17z",5,"Me encantó el lugar, la camarera super atenta nos recomendó platos buenazos, el ambiente agradable y la comida deliciosa y todo echo por ellos, excelente seguro volveré a ir, recomiendo pagar la barra libre si deseas probar de todo porque se come muy bien!"
El Mexicano Tacos & Burritos,"-12.1220962,-77.0310092,17z",5,"Excelente punto de comida.
Todos los platos buenísimos...pero de todos los infaltables son los nachos de barbacoa con su respectiva agua de tamarindo 🐷!…"
El Mexicano Tacos & Burritos,"-12.1220962,-77.0310092,17z",1,"Mala experiencia, fui con mi familia a celebrar un evento, no habia mesa disponible por lo que teniamos que esperar, nos pusieron en la lista de espera, habia tres grupos antes que nosotros, que iban pasando cada 15 minutos aprox. Cuando ya…"
El Mexicano Tacos & Burritos,"-12.1220962,-77.0310092,17z",5,La comida del Mexicano es lo máximo. Sus desayunos excelentes bastante contundentes. Su local de benavides es bastante acogedor y su decoración bastante representativa. La atención debería mejorar un poquito.
El Mexicano Tacos & Burritos,"-12.1220962,-77.0310092,17z",5,Excelente inversión gastronómica si vas por el All you can eat. Las salsas picantes son buenazas y las quesadillas combinan muy bien con el agua de jamaica. Recomiendo ir temprano porque El Mexicano se llena rápido.
El Mexicano Tacos & Burritos,"-12.1220962,-77.0310092,17z",4,"Excelente lugar, bien decorado, buena atención aunque a veces no se dan abasto por la cantidad de personas que llegan. Ademas tienen buena sazón, que más se puede pedir."
El Mexicano Tacos & Burritos,"-12.1220962,-77.0310092,17z",2,"Se demora la atención espere aproximadamente 20 minutos, el local es pequeño así que tienes que esperar en la calle directamente, el sabor de los tacos no cumple las espectativas, la salsa más picante del lugar ""santa muerte"" no picaba, se…"
El Mexicano Tacos & Burritos,"-12.1220962,-77.0310092,17z",5,"Buen lugar ,un poco pequeño el local de miraflores pero la comida es muy buena y el agua de Jamaica rica también ,exelente atención"
El Mexicano Tacos & Burritos,"-12.1220962,-77.0310092,17z",3,"Los tacos son buenos, las tostadas también, pero lo demás no vale la pena comer. La opción""all you can eat"" es una estrategia engañosa, pues con un solo plato ya te llenas. El texmex no se nota. La atención es lenta. El local es chico e incómodo. Sin embargo es una buena iniciativa."
El Mexicano Tacos & Burritos,"-12.1220962,-77.0310092,17z",3,"Comida muy rica, poco saludable, pero muy rica. Y muy pocas mesas, por lo que si no eres paciente. No pierdas tu tiempo"
El Mexicano Tacos & Burritos,"-12.1220962,-77.0310092,17z",1,"Por un lado el sabor de los rellenos del taco es muy agradable y las salsas variadas también son ricas, pero no son lo que dicen ser, pedimos tacos al pastor y nos trajeron carne picada en cubitos sofrita, que no tiene nada que ver con Al…"
El Mexicano Tacos & Burritos,"-12.1220962,-77.0310092,17z",1,"Nada rico, el lugar es muy chico y ruidoso.
Las comidas no son tan ricas, no vale la pena el all you can eat."
El Mexicano Tacos & Burritos,"-12.1220962,-77.0310092,17z",4,"Bueno, acogedor y bien decorado, los mozos son muy atentos y la atención rápida, la comida es bastante buena, con gran variedad y barato relativamente, especialmente los tacos al pastor. El único problema es el espacio muy reducido que tiene el local."
El Mexicano Tacos & Burritos,"-12.1220962,-77.0310092,17z",4,"Buen local, buena atención y me parece que la comida la tienen lista para calentar en algunos platos. Ojo todo rico precios standard."
El Mexicano Tacos & Burritos,"-12.1220962,-77.0310092,17z",4,"Un lugar chévere, buen point.  Solo que tuve que hacer mi cola casi 40 minutos y ya entre casi cuando hiban a cerrar.   Pero valió la pena, tienen todas las salsas mexicanas, los taquitos son bien ricos y tienen esas aguas frescas del chavo.  Regresaré."
El Mexicano Tacos & Burritos,"-12.1220962,-77.0310092,17z",2,"El sabor es bueno, normalito.La atención es regular! No se establecen claras las reglas de la barra. Los platos que se pidieron en más de una ocasión hubo error en la preparación."
El Mexicano Tacos & Burritos,"-12.1220962,-77.0310092,17z",4,Una buena alternativa para los amantes de la comida mexicana en Lima.  Buenos platillos a precios muy accesibles.
El Mexicano Tacos & Burritos,"-12.1220962,-77.0310092,17z",1,"Cuando fui una primera vez me dijeron que atendían con reserva anticipada, llamo a su local y me dicen que la atención es por orden de llegada y que era imposible el tema de reservas, entonces de que se trata este juego?"
El Mexicano Tacos & Burritos,"-12.1220962,-77.0310092,17z",4,"El lugar bonito, acogedor, buena comida pero deberían ampliarlo, me parece muy pequeño, fui un martes al rededor de las 8pm y cuando entré solo tenía un par de mesas libres y a los minutos se llenó y la gente que llegaba tenía que esperar."
El Mexicano Tacos & Burritos,"-12.1220962,-77.0310092,17z",4,"Buen ambiente, pero el espacio es muy chico, la comida es muy rica pero a veces las carnes fríen demasiado y se siente un amargo en las carnes. Y su carta de bebidas es muy corta, solo cuentas con 4 o 5 bebidas"
El Mexicano Tacos & Burritos,"-12.1220962,-77.0310092,17z",4,"Muy buena atención, aunque la tortilla que usan para los tacos no pasa nada. Pero la comida en sí, está buena :)"
El Mexicano Tacos & Burritos,"-12.1220962,-77.0310092,17z",1,"Que tengan una promoción ""All you can eat"" y no entiendan que solo puedes comer un burrito y que por eso no van a atender a la mesa porque todos deben comer lo mismo.…"
El Mexicano Tacos & Burritos,"-12.1220962,-77.0310092,17z",4,"Comida y atencion espectaculares. Un menú un poco complicado de entender y el lugar queda un poco pequeño para grupos de 5 personas a mas. 100% recomendado, es una experiencia muy grata."
El Mexicano Tacos & Burritos,"-12.1220962,-77.0310092,17z",1,No pasa nadaaa... Hace 3 años era sabor y calidad.. ahora es mucha grasa... Los tacos estaban llenos de aceite por dónde lo miraras.. no recordaba al mexicano así..
El Mexicano Tacos & Burritos,"-12.1220962,-77.0310092,17z",5,"Es un restaurante de comida tex-mex que no te puedes perder. A pesar de que el local es pequeño, cuenta con una decoración increíble, la atención es muy buena, los sabores deliciosos y equilibrados. Me encantó el agua de Jamaica. Eso sí, si no eres muy tragón te conviene más pedir a la carta que el All you can eat."
El Mexicano Tacos & Burritos,"-12.1220962,-77.0310092,17z",3,"Un poco disforzada la atención. Local pequeño, pero acogedor. Graciosas algunas decoraciones. El burrito al pastor es buenísimo, 25 soles. Recomiendo probar las salsas picantes."
El Mexicano Tacos & Burritos,"-12.1220962,-77.0310092,17z",4,"El burrito es muy bueno, no se desarma o se te hace una sopa, viene envuelto en papel platina, el cual se va rasgando según vas comiendo. Los nachos son espectaculares, vienen con frijoles crema agria y palta mas alguna carne a tu elección.…"
El Mexicano Tacos & Burritos,"-12.1220962,-77.0310092,17z",4,"La comida muy buena, la atención excelente, lo malo es que no venden bebidas alcohólicas  en el local de Miraflores y los precios un poco altos."
El Mexicano Tacos & Burritos,"-12.1220962,-77.0310092,17z",5,"Muy exquisito, en especial el burrito chingon recomendable para llevar al final de la noche o consumir en su pequeño local, es super llenador.... costo 24 soles"
El Mexicano Tacos & Burritos,"-12.1220962,-77.0310092,17z",1,"Es carisimo, cuando llamas para oedir por  delivery, no responden nunca.
Me parece ridiculo, el tamaño de los postes que venden las carnes y super caro. No lo recomiendo"
El Mexicano Tacos & Burritos,"-12.1220962,-77.0310092,17z",3,"Espacios para consumo algo pequeños, preferible es pedir para llevar. Buen ambiente y el personal es agradable. La comida está muy bien, sus salsas picantes son buenazas."
El Mexicano Tacos & Burritos,"-12.1220962,-77.0310092,17z",3,"Pedí para llevar por que no llegaba mi hija a los 5 minutos llego y no quisieron servirme en la mesa el pedido, y se demoraron más de 40 minutos en atenderme"
El Mexicano Tacos & Burritos,"-12.1220962,-77.0310092,17z",4,Estuvo bueno. Pequeño pero cómodo. No sabía que cobraban extra por la crema agria  y no lo vi en el menú. Pero el chico me la excluyó. Volvería.
El Mexicano Tacos & Burritos,"-12.1220962,-77.0310092,17z",4,"Muy rica y variedad en la carta, buena atención. Lo único es que me gustaría que el local de Miraflores fuera más amplio, pero lo demás muy bueno."
El Mexicano Tacos & Burritos,"-12.1220962,-77.0310092,17z",5,"Rica la comida de la barra libre y el chico que nos atendió, excelente"
El Mexicano Tacos & Burritos,"-12.1220962,-77.0310092,17z",4,"Todo bien, pero si quieres comer tranquila (no barra libre) es hipercaro. Solo vale la pena venir por barra libre 😄…"
El Mexicano Tacos & Burritos,"-12.1220962,-77.0310092,17z",5,"Los protocolos de seguridad se cumplen al pie de la letra respetando el aforo, la comida excelente al igual que el servicio. Recomiendo la gringa de pastor, igual a una en México 😁👌…"
El Mexicano Tacos & Burritos,"-12.1220962,-77.0310092,17z",5,"El mejor restaurante mexicano de Lima. Un restaurante pequeño sin mayores pretensiones,  con una decoración sencilla pero muy original.  Comida fresca,  deliciosamente preparada.  Con un sistema All U can eat. Si llega y debe esperar,  vale…"
El Mexicano Tacos & Burritos,"-12.1220962,-77.0310092,17z",1,Los precios no son lo que dicen en la carta. Qué tipo de restaurante mexicano no tiene guacamole? No si quiera advierten.…
El Mexicano Tacos & Burritos,"-12.1220962,-77.0310092,17z",1,"Lo único bueno de este lugar es que con lo que pagas, de que te llenas, te llenas .. pero de ahí en fuera, la comida está algo condimentada, los tacos mal servidos (no se deben juntar las tortillas si es que van a servir una orden de 3, por…"
El Mexicano Tacos & Burritos,"-12.1220962,-77.0310092,17z",5,"Todo super rico... El servicio bien atento y explica muy bien los platos, la comida sale super rápido"
El Mexicano Tacos & Burritos,"-12.1220962,-77.0310092,17z",4,"Estuvo bueno, contundente , a buen precio, rico ( para le faltaba un poco de ají). Encontrar lugar es algo difícil xq es pequeño el local"
El Mexicano Tacos & Burritos,"-12.1220962,-77.0310092,17z",4,"Todo bien, pero para los que van por primera vez vez les informo que el agua de Jamaica no lleva mucha azúcar, es algo similar a la chica morada. Recomiendo acompañar la comida con una gaseosa."
El Mexicano Tacos & Burritos,"-12.1220962,-77.0310092,17z",5,"Buenísimo. Recomiendo el de surco. El de Miraflores tiene una atención pésima. Hay un chico que recibe a los clientes, y es súper déspota. No lo recomiendo."
El Mexicano Tacos & Burritos,"-12.1220962,-77.0310092,17z",5,"Muy bueno, les recomiendo el burrito"
El Mexicano Tacos & Burritos,"-12.1220962,-77.0310092,17z",5,"Buen menú con varias opciones de carne y vegetariana. Hay opción de pagar por all you can eat, yo diría que vale la pena. El lugar es pequeño, pero nunca lo he visto muy lleno."
El Mexicano Tacos & Burritos,"-12.1220962,-77.0310092,17z",5,"Excelente atención. Linda decoración, hasta el baño es lindo 🤩…"
El Mexicano Tacos & Burritos,"-12.1220962,-77.0310092,17z",5,"Comida deliciosa, pero como el local es pequeño, hay que ir preparado a hacer cola."
El Mexicano Tacos & Burritos,"-12.1220962,-77.0310092,17z",5,"Me gustó mucho que las tortilla fueran ""hechas en casa"" eso le da un sabor distinto a la comida. Los guisos que probé me encantaron. Para mi, es lugar recomendable"
El Mexicano Tacos & Burritos,"-12.1220962,-77.0310092,17z",4,"Buena presentación, variedad y bueno"
El Mexicano Tacos & Burritos,"-12.1220962,-77.0310092,17z",5,Atención rápida y eficiente sin duda una excelente opción para degustar cocina mexicana
El Mexicano Tacos & Burritos,"-12.1220962,-77.0310092,17z",1,"Comida mediocre y mal presentada, en un papel que se deshace y que uno acaba comiéndose. Los burritos, extrañamente vienen con el arroz (amarillo!) al lado, no adentro, y olvidaron traerlo. Las salsas no son auténticas, por ejemplo la de…"
El Mexicano Tacos & Burritos,"-12.1220962,-77.0310092,17z",1,"La atención pésima, más de 1 hora para esperar de nuevo un pedido que se lo dieron a otra mesa...  La comida no está tan rica, la horchata era leche con azúcar y le pusieron canela encima... En verdad una decepción"
El Mexicano Tacos & Burritos,"-12.1220962,-77.0310092,17z",3,"Espacio muy reducido, tienes que compartir la mesa con otras personas. Precio un poco elevado para lo que sirven. Sabor aceptable en mi opinión..."
El Mexicano Tacos & Burritos,"-12.1220962,-77.0310092,17z",3,"a mis hijos le gustó, a mi esposa le gustó ... yo no volvería nunca más!
El lugar incómodo, la comida demasiado condimentada, el ""all you can eat"", incluye sólo un tipo de bebida (agua de jamaica) ... hasta la vista baby !!!"
El Mexicano Tacos & Burritos,"-12.1220962,-77.0310092,17z",4,"A pesar de que la atención es muy buena, la comida siento que le falta más sazón y amor mexicano. Estaba muy bueno todo pero puede estar mucho mejor."
El Mexicano Tacos & Burritos,"-12.1220962,-77.0310092,17z",5,"La comida es buenaza, el precio del all-you-can-eat es justo y si eres de buen diente como yo lo vas a aprovechar muy bien. Puedes pedir salsas y refresco tambien incluidas."
El Mexicano Tacos & Burritos,"-12.1220962,-77.0310092,17z",1,"Sinceramente si podria darle menos puntos lo haria, de la atención no me quejo la verdad fui bien atendida pero con respecto a la comida no la recomiendo en absoluto, me cayo todo super mal y no solo a mi sino a mis acompañantes y no se que…"
El Mexicano Tacos & Burritos,"-12.1220962,-77.0310092,17z",3,"Mas o menos, los platos son muuy salados pero el agua de Jamaica es rico, el baño si es decente y tiene papel de 1 hoja. La propina es obligatorio"
El Mexicano Tacos & Burritos,"-12.1220962,-77.0310092,17z",5,Compre algo para llevar. Me atendieron bien y estaba muy rico. El ambiente es agradable. Ya quiero volver a probar el resto de comida.
El Mexicano Tacos & Burritos,"-12.1220962,-77.0310092,17z",4,"Rica comida fosion texana/mexicana y probablemente la mejor opción de comida mexicana en la zona, su opción de comer todo lo que desees por 45 soles es una forma excelente de navegar por su menú y saber exactamente cuál es el plato que más…"
El Mexicano Tacos & Burritos,"-12.1220962,-77.0310092,17z",1,"Mucho tiempo de espera, y no tuvieron un poco de preocupación, mala atención, chimichangas demasiado grasosas, los rellenos de taco muy secos sin gusto, jugo de mora, no sé que variedad usaron pero muy insípido, las salsas si estaban ricas, lástima la atención más que todo. Solo nombre"
El Mexicano Tacos & Burritos,"-12.1220962,-77.0310092,17z",4,"Es rico barato y contundente, la atención genial, platos unos muy ricos otros les falta, pero probé la vieja carta el nuevo promete seguro mejoran esos platos que le faltaba un poco"
El Mexicano Tacos & Burritos,"-12.1220962,-77.0310092,17z",2,"Un lugar agradable. Demasiado pequeño. Sabores mexicanos 40%. Buenos chiles. Falta relleno: quesadillas sin o con poquísimo queso, tacos al pastor con.poca carne, etc."
El Mexicano Tacos & Burritos,"-12.1220962,-77.0310092,17z",5,Orale mis carnales estuvo bien chido el canton y la comida ni que hablar exitos mis cuates feliz año nuevo
El Mexicano Tacos & Burritos,"-12.1220962,-77.0310092,17z",3,"Muy pequeño, no vendían cerveza y pedimos platos para compartir y no tenían"
El Mexicano Tacos & Burritos,"-12.1220962,-77.0310092,17z",5,Muy buena comida mexicana y tex-mex. La atención muy buena también
El Mexicano Tacos & Burritos,"-12.1220962,-77.0310092,17z",2,Buena comida. El problema es que al llegar estaban soldando la puerta (mucho humo y luz cegadora). Salí con fuertes dolores de cabeza.
El Mexicano Tacos & Burritos,"-12.1220962,-77.0310092,17z",5,"Los burritos son deliciosos, pero llenan harto. Hay que ir con el estómago bien vacío para aprovechar al máximo el all you can eat."
El Mexicano Tacos & Burritos,"-12.1220962,-77.0310092,17z",3,"Buena variedad de tacos y burritos tipo tradicionales y tex mex. También buena selección de carnes. Probé los tacos al pastor (muy buenos), burritou a la barbacoa (regular por la carne, muy condimentada) y un taco crocante de cochinita que…"
El Mexicano Tacos & Burritos,"-12.1220962,-77.0310092,17z",4,"Muy buena barra libre y atención al cliente. El local es pequeño pero, ¡el sabor es gigante! Y sus salsas son muy ricas."
El Mexicano Tacos & Burritos,"-12.1220962,-77.0310092,17z",3,"Me parecio un lugar demasiado pequeño, no valr la verdad los 40 soles, ya que las porciones son tan grandes que solo podrias comer un plato, de lo contrario si pides algo mas y terminas te cobraran el plato como plato a la carta los cuales…"
El Mexicano Tacos & Burritos,"-12.1220962,-77.0310092,17z",4,"Tiene poco espacio, llamar antes de ir, estuvimos en lista de espera por casi una hora, la atención es buena y la comida muy rica"
El Mexicano Tacos & Burritos,"-12.1220962,-77.0310092,17z",1,"Burrito mexicano al pastor: buen tamaño, muy muy salado, poca sazón.
Burritow carne asada: enrollado en papel aluminio, salado, poco agradable la combinación.…"
El Mexicano Tacos & Burritos,"-12.1220962,-77.0310092,17z",4,"Bonito y acogedor, quizá necesiten ampliarlo un poco para cuando se llene el local. La comida estuvo buena y las salsas ricas y picantes"
El Mexicano Tacos & Burritos,"-12.1220962,-77.0310092,17z",5,Excelente barra libre tex-mex con una amplia variedad de carnes a elegir. Buena ambientación y agradable servicio. Cuenta con refill de agua de Jamaica.
El Mexicano Tacos & Burritos,"-12.1220962,-77.0310092,17z",3,El mexicano de Miraflores realmente tiene mucho en que trabajar.
El Mexicano Tacos & Burritos,"-12.1220962,-77.0310092,17z",4,"El personal fue muy muy amable. La comida estuvo ok, pero los tacos estaban muy duros. Costaba masticarlos."
El Mexicano Tacos & Burritos,"-12.1220962,-77.0310092,17z",4,El espacio es reducido pero ofrecen buena comida
El Mexicano Tacos & Burritos,"-12.1220962,-77.0310092,17z",1,"Pésima atención, deberían ser más cordiales y salir por lo menos a tomar el pedido del cliente y no hacerlo esperar en vano. Me fui decepcionada del lugar."
