titulo,coordenada,calificacion,comentario
El Mexicano Tacos & Burritos,"-12.1220962,-77.0310092,17z",1,"Comenzamos por el servicio , pésimo, teniamos q pedirle toooodo , los tenedores, q las servilletas , q las salsas , q el limon , etc. Tantos staff para un lugar pequeño al pedo . Los Tacos re salados y las tostadas muy aceitosas."
El Mexicano Tacos & Burritos,"-12.1220962,-77.0310092,17z",3,"Deliciosa comida! Me sabe a comida mexicana, excelente presentación y decoración sin embargo eso de las penalidades no me parece y el local por ser tan pequeño no es cómodo para familias."
El Mexicano Tacos & Burritos,"-12.1220962,-77.0310092,17z",3,"Es preferible ir temprano porque el local se llena, la comida es buena por no decir buenísima, ya que cuando esto pasa se apresuran y la calidad de su comida baja. Los precios son muy asequibles"
El Mexicano Tacos & Burritos,"-12.1220962,-77.0310092,17z",3,"Buen lugar para comer algo de la carta no el ""Todo lo que puedas comer"" no pidas los tacos al pastor a menos que te gusten con piña .. en lo personal le doy un 6/10 💕 (ah y enseñas bebidas solo es agua de Jamaica la gaseosa es aparte)…"
El Mexicano Tacos & Burritos,"-12.1220962,-77.0310092,17z",5,"Vinimos a El Mexicano por curiosidad, pues bien... Todo rico, muy parecido a lo que probé en México. La atención buena... Estamos esperando regresar pero al nuevo local."
El Mexicano Tacos & Burritos,"-12.1220962,-77.0310092,17z",1,"Desagradable !!! Demasiado condimentado   , nos querían sacar de la mesa porque no era para dos personas , la señorita no había no realizó bien el pedido que se demoró demasiado y volvió a la mesa para decir que era lo que habíamos pedido ...... Realmente pase un mal momento!"
El Mexicano Tacos & Burritos,"-12.1220962,-77.0310092,17z",4,"Agradable ambiente y servicio muy bueno, lo único es que la tortilla de sus burritos era muy seca. Por lo demás muy bien"
El Mexicano Tacos & Burritos,"-12.1220962,-77.0310092,17z",4,"Buenos tacos, y burritos. El servicio es muy bueno. El lugar es acogedor, fines de semana puede estar lleno. No demoran mucho en atender"
El Mexicano Tacos & Burritos,"-12.1220962,-77.0310092,17z",5,"Buena comida, el local es pequeño y tienes q esperar q aya espacio"
El Mexicano Tacos & Burritos,"-12.1220962,-77.0310092,17z",5,"Muy buena atención y tiempo de servicio, la variedad platos me encantó, sobretodo laa chimichangas con barbacoa"
El Mexicano Tacos & Burritos,"-12.1220962,-77.0310092,17z",4,No pudimos con el all you can eat. Recomiendo solo pedir platos a la carta a menos que vayas por cosas pequeñas y mucha hambre. Los burritos son gigantes!
El Mexicano Tacos & Burritos,"-12.1220962,-77.0310092,17z",5,"Gran lugar, los platos a la carta estuvieron buenísimos, super amables y responden cualquier duda sobre la carta si es tu primera vez 🥰…"
El Mexicano Tacos & Burritos,"-12.1220962,-77.0310092,17z",5,Muy buena comida!
El Mexicano Tacos & Burritos,"-12.1220962,-77.0310092,17z",4,Rico falto variedad de bebidas
El Mexicano Tacos & Burritos,"-12.1220962,-77.0310092,17z",4,"Excelente lugar, magnífica atención . Solo si mejoran las tortillas un poco más hechas se ganan el cielo. Volveré a ver si lo arreglan."
El Mexicano Tacos & Burritos,"-12.1220962,-77.0310092,17z",5,"Todo es muy rico. La atención también es buena y, el ambiente es bastante pintoresco. Incluso ir al baño es una experiencia artística jajajaja. Muy recomendado."
El Mexicano Tacos & Burritos,"-12.1220962,-77.0310092,17z",5,Agradable ambiente y servicio. Algunos tacos mejores que otros. Recomiendo pedir a la carta en vez de barra libre 😉💯…
El Mexicano Tacos & Burritos,"-12.1220962,-77.0310092,17z",4,"Me gustaron muchos los tacos y el precio es accesible. El “All you can eat” si vale la pena, hasta te dan la opción de pedir el burrito con o sin frejoles."
El Mexicano Tacos & Burritos,"-12.1220962,-77.0310092,17z",4,La comida que se exquisita. La atención también. Solo el local es muy pequeño y los baños dan directamente a las últimas dos mesas.
El Mexicano Tacos & Burritos,"-12.1220962,-77.0310092,17z",2,"Muy buena atención, pero la comida aún tiene cosas que mejorar"
El Mexicano Tacos & Burritos,"-12.1220962,-77.0310092,17z",5,"Buena comida, menú variado, el local es pequeño, pero bien distribuido, la atención es buena, sirven rápido , recomiendo los nachos!"
El Mexicano Tacos & Burritos,"-12.1220962,-77.0310092,17z",4,"La comida es buena, tienen variedad de platos y la opción de all you can eat es buena, excepto cuando hay mucha gente"
El Mexicano Tacos & Burritos,"-12.1220962,-77.0310092,17z",4,"La comida buena, aunque muy condimentada."
El Mexicano Tacos & Burritos,"-12.1220962,-77.0310092,17z",4,"Buena atención, precios accesibles, dan recomendaciones si vas por primera vez y no sabes con que comenzar, el agua de Jamaica me encantó. Lugar pequeño y agradable."
El Mexicano Tacos & Burritos,"-12.1220962,-77.0310092,17z",3,"Me gustó. No podría decir que son tacos hechos de la manera tradicional, Porque nunca he comido tacos originales. Pienso que deberian ser más grandes, nomas"
El Mexicano Tacos & Burritos,"-12.1220962,-77.0310092,17z",5,Excelente comida! Fui el otro viernes a probar el all u can eat y la verdad que todo muy bueno. Lo recomiendo...
El Mexicano Tacos & Burritos,"-12.1220962,-77.0310092,17z",3,"Espacio muy reducido, tiempo de espera de 20 a 30 min un domingo a las 4 pm. Mis expectativas de la sazón era más altas."
El Mexicano Tacos & Burritos,"-12.1220962,-77.0310092,17z",4,"Buena comida para el ""All you can eat"", aunque no estaría mal si tambien ofrecieran agua de limon y tamarindo(otras bebidas incluidas), eso sin quitarle valor a la riquisima al agua de jamaica."
El Mexicano Tacos & Burritos,"-12.1220962,-77.0310092,17z",4,"Buenísimos los tacos pero si no te sientas cerca a la puerta, te vas a morir se calor y es super incómodo. Pero insisto la comida es muy buena y el precio es justo a mi parecer."
El Mexicano Tacos & Burritos,"-12.1220962,-77.0310092,17z",5,"Excelente atención, excelente comida, volvería a ir con los ojos cerrados. Recomendadísimo"
El Mexicano Tacos & Burritos,"-12.1220962,-77.0310092,17z",4,"Porciones algo pequeñas, ambiente agradable algo pequeño tambien. Menú curioso pero rico . Personal super amable atención excelente."
El Mexicano Tacos & Burritos,"-12.1220962,-77.0310092,17z",4,"La comida muy buena, el local es muy pequeño para el precio que cobran ( los corridos tumbados que tenían en ese momento no son los adecuados para un restaurante)"
El Mexicano Tacos & Burritos,"-12.1220962,-77.0310092,17z",3,Buena atención el lugar es pequeño pero acogedor espero que para la inauguración de su próximo local haya más variedad en bebidas
El Mexicano Tacos & Burritos,"-12.1220962,-77.0310092,17z",4,"Tiene una buena sazón y una buena atención, lo malo es que el local es muy pequeño y esperaba encontrar enchiladas.  Espero pronto mejoren eso y seguramente se volverá un 5 estrellas"
El Mexicano Tacos & Burritos,"-12.1220962,-77.0310092,17z",4,Sabroso
El Mexicano Tacos & Burritos,"-12.1220962,-77.0310092,17z",5,"Aprovecha probar de todo un poco con la Barra Libre que ofrecen. El lugar es pequeño, y los fines de semana siempre está lleno, a veces tienes que esperar de 15-30 min para poder ingresar."
El Mexicano Tacos & Burritos,"-12.1220962,-77.0310092,17z",5,"Buen precio, enorme variedad, excelente calidad y sazón, servicio un poco lento pero aceptable. Volvería muchas veces!!!"
El Mexicano Tacos & Burritos,"-12.1220962,-77.0310092,17z",5,"Recomendado al 100%. Riquísima y variada comida tradicional Mexicana, con una excelente atención y muy buen servicio."
El Mexicano Tacos & Burritos,"-12.1220962,-77.0310092,17z",4,"Me gustó todo, la comida buenaza, pero no te ponen platos, ni cubiertos, eso me desagradó, y los asientos de madera son la cosa más incomoda del mundo"
El Mexicano Tacos & Burritos,"-12.1220962,-77.0310092,17z",1,"La tortilla no tenía buen sabor, ni textura, el refresco de Jamaica nos cayó mal a mí y a las otras dos personas que fueron conmigo, a una de las personas que me acompañaron demoraron 30' en traerle el pedido porque se equivocaron y se llevaron el pedido a otra mesa."
El Mexicano Tacos & Burritos,"-12.1220962,-77.0310092,17z",3,Lugar pequeño. La comida no está mal. El día que fui solo había bebida de mora y no estaba rica
El Mexicano Tacos & Burritos,"-12.1220962,-77.0310092,17z",3,"La comida no parece tan fresca, los nachos estaban Flácidos, y no crocantes, experiencia intermedia."
El Mexicano Tacos & Burritos,"-12.1220962,-77.0310092,17z",5,"Un lugar agradable y cómodo, la atención de primera, ofrecen barra libre, y la comida es deliciosa."
El Mexicano Tacos & Burritos,"-12.1220962,-77.0310092,17z",5,La comida ea sabrosa... presentación excelente y el precio no es caro... para regresar con amigos o celebrar un cumpleaños
El Mexicano Tacos & Burritos,"-12.1220962,-77.0310092,17z",5,El burrito TX es muy bueno para 2 personas con agua de jamiaca
El Mexicano Tacos & Burritos,"-12.1220962,-77.0310092,17z",3,"Buena comida, lo malo es que tardan mucho en servir."
El Mexicano Tacos & Burritos,"-12.1220962,-77.0310092,17z",4,El all you can eat es genial ese día la atención fue de lujo lo que si el local es pequeño pero acogedor
El Mexicano Tacos & Burritos,"-12.1220962,-77.0310092,17z",1,"Pesima atención, fuimos y teniendo mesas vacías dijeron que había lista de espera de más de una hora y ya cerrarían a esa hora."
El Mexicano Tacos & Burritos,"-12.1220962,-77.0310092,17z",1,"Local pequeño, 3 personas dentro de una cocina pequeña causan más estorbo, platos fríos y para q tu pedido llegue tienes q esperar q salga el del cliente q llego 1ero q tu. No regresaré"
El Mexicano Tacos & Burritos,"-12.1220962,-77.0310092,17z",4,"Agradable restaurante Mexicano, ricos los tacos, las chilaquiles y las tostadas. En esta sede de Miraflores no venden licor."
El Mexicano Tacos & Burritos,"-12.1220962,-77.0310092,17z",3,"Demasiado incómodo las mesas y bancas para sentarse a comer , la comida regular se parece bastante a la de México pero le falta , deben mejorar .Gracias."
El Mexicano Tacos & Burritos,"-12.1220962,-77.0310092,17z",5,"Genial la barra libre. Los tacos son excelentes, ingredientes frescos y sabrosos. Servicio amable y cordial."
El Mexicano Tacos & Burritos,"-12.1220962,-77.0310092,17z",5,"Muy buena comida tanto mexicana como tex-mex.
Las carnes y las salsas son muy ricas, la cochinita pibil la mejor de todas.
El local es pequeño pero acogedor...recomendado!"
El Mexicano Tacos & Burritos,"-12.1220962,-77.0310092,17z",4,"Un poco pequeño el lugar, pero vale mucho la pena, precios cabales, solo falta más variedad, cómo tener alambres, sería estupendo."
El Mexicano Tacos & Burritos,"-12.1220962,-77.0310092,17z",4,"Ricos tacos, la barbacoa un poco salada.. Muy recomendable los tacos de alambre y sus flautas! Sigan dando tan bien servicio"
El Mexicano Tacos & Burritos,"-12.1220962,-77.0310092,17z",5,"La comida es exquisita, el ambiente es super agradable y la atención excelente, 100% recomendado."
El Mexicano Tacos & Burritos,"-12.1220962,-77.0310092,17z",5,"Es lo más cercano a la comida mexicana de a diario. Tienen variedad de platillos y opcines para combinar. El restaurante es chiquito, pero bien cálido. Regresaremos."
El Mexicano Tacos & Burritos,"-12.1220962,-77.0310092,17z",5,"Excelente atención, la comida muy buena, los recomiendo"
El Mexicano Tacos & Burritos,"-12.1220962,-77.0310092,17z",5,Muy rico y buena atención!
El Mexicano Tacos & Burritos,"-12.1220962,-77.0310092,17z",3,"Hay variedad de tacos y son ricos, aunque podrían ser mejores. El resto de la carta no es tan bueno y no hay variedad de platos de comida mexicana. Podría ser mejor pero esta OK."
El Mexicano Tacos & Burritos,"-12.1220962,-77.0310092,17z",5,"Barra libre espectacular, jugo de Jamaica y churros de cortesía, 50% descuento al cumpleañero, barra libre S/ 49.00"
El Mexicano Tacos & Burritos,"-12.1220962,-77.0310092,17z",5,"La comida muy rica, aunque la decoración parece de una cantina del viejo oeste, la atención también es buena"
El Mexicano Tacos & Burritos,"-12.1220962,-77.0310092,17z",4,"Buen lugar para comer platillos mexicanos y tex-mex. La comida es buenísima, la atención puede mejorar y el local es algo pequeño, no recomendaría ir con coches de bebé."
El Mexicano Tacos & Burritos,"-12.1220962,-77.0310092,17z",5,"Ambiente agradable, muy buena comida y excelente atención."
El Mexicano Tacos & Burritos,"-12.1220962,-77.0310092,17z",3,"Buena comida, mesas mal limpiadas y con olor desagradable."
El Mexicano Tacos & Burritos,"-12.1220962,-77.0310092,17z",5,"Me parece un lugar para compartir un día lleno de experiencias y sonrisas,  degustar comida que rompe los lineamientos habituales y te permite conocer de manera intima el concepto  mexicano...  Si lo recomiendo? SI..."
El Mexicano Tacos & Burritos,"-12.1220962,-77.0310092,17z",5,"Atención muy buena, respetan el distanciamiento. Chicos atentos. Y los platos deliciosos."
El Mexicano Tacos & Burritos,"-12.1220962,-77.0310092,17z",5,Excelente sabor muy buena la comida recomendó
El Mexicano Tacos & Burritos,"-12.1220962,-77.0310092,17z",5,"Exquisitos platos, muy muy agradable mero mero Mexico. Recomendable."
El Mexicano Tacos & Burritos,"-12.1220962,-77.0310092,17z",3,"Han variado mucho el tipo de taco, me gustaba los que hacían al comienzo, ahora los siento mas salados (he ido 4 veces), apostaba que mejoraría pero no fue así"
El Mexicano Tacos & Burritos,"-12.1220962,-77.0310092,17z",5,"Buen lugar, la comida fresca y ni que decir de las salsas que te puedes servir las veces que quieras"
El Mexicano Tacos & Burritos,"-12.1220962,-77.0310092,17z",5,"Muy buena atención, los platos son buenazos"
El Mexicano Tacos & Burritos,"-12.1220962,-77.0310092,17z",5,"Muy buenos chilaquiles, nachos y quesadillas"
El Mexicano Tacos & Burritos,"-12.1220962,-77.0310092,17z",5,Muy buena comida! Cualquier de los platos te puede llenar y se disfruta siempre con su agua de Jamaica al lado! 😋…
El Mexicano Tacos & Burritos,"-12.1220962,-77.0310092,17z",4,Variedad de platos mexicano y tienen all you can eat
El Mexicano Tacos & Burritos,"-12.1220962,-77.0310092,17z",4,Lo mejor es que hay All you can eat y puedes aprovechar en comer de todo un poco. Tener respeto por el burrito y dejalo para el final es lo más recomendable
El Mexicano Tacos & Burritos,"-12.1220962,-77.0310092,17z",5,Lo mejor q e visitado
El Mexicano Tacos & Burritos,"-12.1220962,-77.0310092,17z",5,"Como si estuviera en México, ricos 😋😋…"
El Mexicano Tacos & Burritos,"-12.1220962,-77.0310092,17z",5,"Me encantó nachos..con mucho queso , guacamole y la salsa de cilantro ..ah y el agua de Jamaica m encanto..es la 2 vez que los visitó.. excelente atención x parte de caballero..Carlos.. 😊…"
El Mexicano Tacos & Burritos,"-12.1220962,-77.0310092,17z",5,Los tacos más parecidos a los verdaderos. El servicio de su local en Miraflores es excelente.
El Mexicano Tacos & Burritos,"-12.1220962,-77.0310092,17z",3,"El buffet no es completo, tiene restricciones y no te dan lo que ofrecen"
El Mexicano Tacos & Burritos,"-12.1220962,-77.0310092,17z",2,"Pienso que de mexicano no tiene más que el nombre, la comida no es mala, sin embargo no es exactamente comida mexicana, sino tex-mex y eso le resta puntos, el sabor de ésta es lo menos mexicano que he probado en mi vida."
El Mexicano Tacos & Burritos,"-12.1220962,-77.0310092,17z",5,Excelente opción para Tacos y burritos 100%mexicanos. Eso si hay que ir con hambre si de burritos se trata.
El Mexicano Tacos & Burritos,"-12.1220962,-77.0310092,17z",2,"Muy buena atención, variedad buenos precios, solo que los tacos y las cremas demasiados salados, tratare de ir una vez mas, haber si cambia eso."
El Mexicano Tacos & Burritos,"-12.1220962,-77.0310092,17z",5,"Rápido atención, muy amables las azafatas y la comida increíble; no pueden dejar pasar la posibilidad de probar los tacos"
El Mexicano Tacos & Burritos,"-12.1220962,-77.0310092,17z",4,"El ambiente es muy bueno, algo pequeño pero acogedor. El sabor de los tacos están normales pero pueden ser mejores."
El Mexicano Tacos & Burritos,"-12.1220962,-77.0310092,17z",5,Los mejores tacos mexicanos que he probado y me los encontré en Perú ! 🤤…
El Mexicano Tacos & Burritos,"-12.1220962,-77.0310092,17z",5,"Buenísimo buffet, súper variado y demasiado bien servido. Sugiero ir en grupo para poder probar varias cosas"
El Mexicano Tacos & Burritos,"-12.1220962,-77.0310092,17z",5,Excelente todo
El Mexicano Tacos & Burritos,"-12.1220962,-77.0310092,17z",5,"Definitivamente uno de los mejores lugares de comida mexicana, y el buffet uffff 🤤😋 ni que decir. 100% recomendado…"
El Mexicano Tacos & Burritos,"-12.1220962,-77.0310092,17z",5,Bonito espacio para conocer la comida y cultura mexicana.
El Mexicano Tacos & Burritos,"-12.1220962,-77.0310092,17z",5,La atención y los platillos aún mejorado muchísimo con respecto a mi ultima visita  todo muy rico
El Mexicano Tacos & Burritos,"-12.1220962,-77.0310092,17z",5,Riquísimo barra libre x1000
El Mexicano Tacos & Burritos,"-12.1220962,-77.0310092,17z",5,Excelente el BOWL CHINGÓN 😬 todo muy rico.…
El Mexicano Tacos & Burritos,"-12.1220962,-77.0310092,17z",5,Los mejores tacos de Lima!! La mejor barra libre! Nos atendieron súper bien y rápido. Voy a regresar de todas maneras!
El Mexicano Tacos & Burritos,"-12.1220962,-77.0310092,17z",4,"A pues, si lugar pequeño, sabor agradable, para venir en grupos pequeños. Buena atención"
El Mexicano Tacos & Burritos,"-12.1220962,-77.0310092,17z",5,"Increible experiencia, la comida muy buena y ambiente muy agradable, perfecto para ir en grupo o pareja."
El Mexicano Tacos & Burritos,"-12.1220962,-77.0310092,17z",3,"El lugar es muy pequeño, largas horas de espera y la comida es regular"
El Mexicano Tacos & Burritos,"-12.1220962,-77.0310092,17z",4,Muy ricos platos variados y a buen precio. El local es pequeño.
El Mexicano Tacos & Burritos,"-12.1220962,-77.0310092,17z",5,"Orale!! La comida muy buena, les recomiendo la barra por la tarde, en la noche es super pesado."
El Mexicano Tacos & Burritos,"-12.1220962,-77.0310092,17z",4,El espacio es acogedor pero le falta comodidad. La comida excelente y la barra libre cumple todas las expectativas
El Mexicano Tacos & Burritos,"-12.1220962,-77.0310092,17z",3,La atención fue buena la comida mas o menos y el local es algo pequeño y no venden tragos :(
El Mexicano Tacos & Burritos,"-12.1220962,-77.0310092,17z",3,"Lo más cercano a la comida Mexicana. Si deseas recordar a México lindo y querido,venir aquí es el mejor lugar🇲🇽…"
El Mexicano Tacos & Burritos,"-12.1220962,-77.0310092,17z",4,Pequeño pero muy linda la decoración y la comida exquisita la atención ni se diga muy amables todos.
El Mexicano Tacos & Burritos,"-12.1220962,-77.0310092,17z",5,"Buenazo!!!!... El tiempo d espera fué poco, variedad de salsas y de tacos, burritos, etc.. Recomendable"
El Mexicano Tacos & Burritos,"-12.1220962,-77.0310092,17z",4,"Buen lugar, pero es muy pequeño y hay mucha bulla. Igual la comida es rica"
El Mexicano Tacos & Burritos,"-12.1220962,-77.0310092,17z",5,"Rico, recomiendo no pedir la barra libre porque te llenas muy rápido, mejor pedir a la carta"
El Mexicano Tacos & Burritos,"-12.1220962,-77.0310092,17z",5,"Excelente servicio, el local es muy acogedor, y ni que habler de la comida, muy sabrosa. Viva El México wey."
El Mexicano Tacos & Burritos,"-12.1220962,-77.0310092,17z",3,"El lugar esta bien simplemente, los tacos son buenos pero me han parecido muy condimentados."
El Mexicano Tacos & Burritos,"-12.1220962,-77.0310092,17z",5,"La comida estuvo muy rica, se sentía un buen ambiente y la atención fue buena"
El Mexicano Tacos & Burritos,"-12.1220962,-77.0310092,17z",5,"Excelente servicio, excelente comida, supieron recomendar ya que fue la primera vez que había ido,"
El Mexicano Tacos & Burritos,"-12.1220962,-77.0310092,17z",5,Demora en la atención pero muy rico sus platos.
El Mexicano Tacos & Burritos,"-12.1220962,-77.0310092,17z",5,Muy buenos tacos estilo mexicano. Les falta poquito para ser los mero meros. Pero están mejor que Chinga Tu Taco.
El Mexicano Tacos & Burritos,"-12.1220962,-77.0310092,17z",3,"Mmm la comida me parecio un poco salada, considero que podria ser un poco mejor en relacion al precio"
El Mexicano Tacos & Burritos,"-12.1220962,-77.0310092,17z",5,"Uno de los mejores restaurantes de comida mexicana en el Perú, excelente atención."
El Mexicano Tacos & Burritos,"-12.1220962,-77.0310092,17z",5,Dicen que es bueno. Fui a visitarlos con mi esposa el día 13 de febrero pero estaba cerrado.
El Mexicano Tacos & Burritos,"-12.1220962,-77.0310092,17z",4,"No venden cervezas ni nada con alcohol, lo demás buenazo"
El Mexicano Tacos & Burritos,"-12.1220962,-77.0310092,17z",5,"Muy buenos, los auténticos tacos mexicanos"
El Mexicano Tacos & Burritos,"-12.1220962,-77.0310092,17z",5,Muy buena la atención rapidez en los pedidos y sobre todo rico me encanto.
El Mexicano Tacos & Burritos,"-12.1220962,-77.0310092,17z",5,"Exelente lugar, muy buena atención, el ambiente es lo máximo."
El Mexicano Tacos & Burritos,"-12.1220962,-77.0310092,17z",5,Muy bueno. Lástima que las quesadillas no estén en la carta para la barra libre
El Mexicano Tacos & Burritos,"-12.1220962,-77.0310092,17z",4,La comida es muy agradable y tienen una excelente atención
El Mexicano Tacos & Burritos,"-12.1220962,-77.0310092,17z",3,La comida no se sentia como es en mexico la salsa no era tan picante como esperaba y la salsa verde no tenia picante que en realidad si deberia tener
El Mexicano Tacos & Burritos,"-12.1220962,-77.0310092,17z",5,"Una gran atención, buenas recomendaciones y de sabor delicioso"
El Mexicano Tacos & Burritos,"-12.1220962,-77.0310092,17z",5,"Me parecio un buen lugar: la decoracion muy llamativa, la atención rápida y la comida muy rica."
El Mexicano Tacos & Burritos,"-12.1220962,-77.0310092,17z",4,Estuvo mejor de lo esperado
El Mexicano Tacos & Burritos,"-12.1220962,-77.0310092,17z",4,Todo muy bueno y rico
El Mexicano Tacos & Burritos,"-12.1220962,-77.0310092,17z",5,"Definitivamente los mejores tacos de lima, muy rico todo. Lo malo que el local es muy pequeño y las bancas algo incomodas."
El Mexicano Tacos & Burritos,"-12.1220962,-77.0310092,17z",1,"Pésima atención llame y me dijeron que podía ir , cuando llegue me dijeron que no podía ingresar sin explicación alguna y mal trato. No volveré"
El Mexicano Tacos & Burritos,"-12.1220962,-77.0310092,17z",5,"Delicioso, sales satisfecho!"
El Mexicano Tacos & Burritos,"-12.1220962,-77.0310092,17z",2,El servicio muy frio. Con respecto a la comida senti que estaba buena pero no lo suficiente como para volver y/o recomendar.
El Mexicano Tacos & Burritos,"-12.1220962,-77.0310092,17z",4,"Tacos ricos y buen precio, sería bueno que tengan más de 1 opción de bebidas. Buen sitio"
El Mexicano Tacos & Burritos,"-12.1220962,-77.0310092,17z",3,"Hay buena variedad de opciones para comer, muy mala atención y déficit de personal."
El Mexicano Tacos & Burritos,"-12.1220962,-77.0310092,17z",5,"La comida es muy rica, recomiendo pagar el buffet (all you can eat)"
El Mexicano Tacos & Burritos,"-12.1220962,-77.0310092,17z",5,"Execelente, comida excelente atencion! 100% recomendó"
El Mexicano Tacos & Burritos,"-12.1220962,-77.0310092,17z",1,"La comida estuvo horrible, con exceso de grasa y condimentos, no tiene nada de sazón mexicano en sus platos, definitivamente no lo recomiendo"
El Mexicano Tacos & Burritos,"-12.1220962,-77.0310092,17z",1,"Esta comida es la mas sobre imitación de la comida mexicana, llegue y la horchata estaba arruinada y la comida es verdaderamente vergonzosa, una ofensa que llamen a este lugar mexicano"
El Mexicano Tacos & Burritos,"-12.1220962,-77.0310092,17z",4,La atención buenísimo.. la comida deja mucho que desear.
El Mexicano Tacos & Burritos,"-12.1220962,-77.0310092,17z",5,Muy buena comida. Cuidado con cuanto coman. Se recomiendan las chimichangas y los nachos.
El Mexicano Tacos & Burritos,"-12.1220962,-77.0310092,17z",4,"Estuvo muy bueno, aunque le falta el saborcito ácido del limon."
El Mexicano Tacos & Burritos,"-12.1220962,-77.0310092,17z",5,simpaticos los sandwiches 👏…
El Mexicano Tacos & Burritos,"-12.1220962,-77.0310092,17z",5,"La comida es riquísima, el servicio muy bueno. Recomendado!"
El Mexicano Tacos & Burritos,"-12.1220962,-77.0310092,17z",4,"Buen trato. No me gustó, opinión personal, pero nada malo que decir."
El Mexicano Tacos & Burritos,"-12.1220962,-77.0310092,17z",2,Es muy pequeño es lugar y le atención es lenta
El Mexicano Tacos & Burritos,"-12.1220962,-77.0310092,17z",4,"Muy buena atención, servicio profesional y rápido. La comida está sabrosa."
El Mexicano Tacos & Burritos,"-12.1220962,-77.0310092,17z",5,La mejor experiencia en comida mexicana y quedé encantada con la atención de todos los chicos.
El Mexicano Tacos & Burritos,"-12.1220962,-77.0310092,17z",5,10/10 excelente atención únicamente muy poco espacio para atender y un poco aforo de atención
El Mexicano Tacos & Burritos,"-12.1220962,-77.0310092,17z",3,La comida buena.  La atención es la que te hace pasar una mala experiencia.
El Mexicano Tacos & Burritos,"-12.1220962,-77.0310092,17z",2,"Espere una mejor atención. Demoraron mucho con la comida y confundieron pedidos. Me pensaría dos veces, para volver."
El Mexicano Tacos & Burritos,"-12.1220962,-77.0310092,17z",2,Su instalación es demasiado pequeña y  se debe de esperar más de 3 horas poder consumir.
El Mexicano Tacos & Burritos,"-12.1220962,-77.0310092,17z",4,lugar tranquilo de buen aspecto y comida casi idéntica.
El Mexicano Tacos & Burritos,"-12.1220962,-77.0310092,17z",5,"Muy buena atención, buen sabor 😋.…"
