titulo,coordenada,calificacion,comentario
El Mexicano Tacos & Burritos,"-12.1220962,-77.0310092,17z",1,"Sinceramente vaya comida me entregaron, no me gustó para nada lo que pedí, lo único rico era la salsa picante. Es demasiado caro como para lo que entregan y el sabor es tan desagradable que ni mis mascotas se atrevieron a comerse ese plato."
El Mexicano Tacos & Burritos,"-12.1220962,-77.0310092,17z",1,Local muy pequeño y falta de insumos en el local y no hay bebidas alcohólicas pero buena atención
El Mexicano Tacos & Burritos,"-12.1220962,-77.0310092,17z",2,"El lugar es acogedor, las meseras muy distraídas, la comida insípida."
El Mexicano Tacos & Burritos,"-12.1220962,-77.0310092,17z",5,"Una sorpresa para mi !!!  Tenia el antojo de taco, google mas me dio la referencia  y EXITO!!! Muy buen dato !! Curiosa forma de pedir los tacos quede muy satisfecho. Dejé mis cometarios ojalá los usen."
El Mexicano Tacos & Burritos,"-12.1220962,-77.0310092,17z",3,"El local es pequeño, las mesas son solo para 4 personas, pero me gustó que tenían separaciones entre mesas. Nunca había probado la comida mexicana, mi primera experiencia fue buena, me gustaron las quesadillas de carne y el agua de jamaica. Le quité puntos porque aparte que el local es muy pequeño."
El Mexicano Tacos & Burritos,"-12.1220962,-77.0310092,17z",3,"Me gustó, su comida, pero creo que se puede mejorar, el ambiente un poco reducido , un poco incómodos los asientos, deben haber mejorado en el proceso de la preparacion en la cocina, el cocinero debía tener gorro mandiles guantes en mejor estado."
El Mexicano Tacos & Burritos,"-12.1220962,-77.0310092,17z",4,Sin duda alguna este restaurante imita la esencia y el sabor de los platillos de la gastronomía mexicana casi a la perfección. El ambiente es agradable (a pesar de que el local sea pequeño) y la atención es adecuada y sencilla.…
El Mexicano Tacos & Burritos,"-12.1220962,-77.0310092,17z",5,"El mero mero taquito wey.
Por donde iniciar esta reseña... Uhmmm.
Quizás por los buenos meseros o el ambiente mas que agradable. El Mexicano me…"
El Mexicano Tacos & Burritos,"-12.1220962,-77.0310092,17z",1,Es el peor burrito que he probado! Sin sabor y la carne chamuscada. No lo recomiendo!!! Me sentí estafada!
El Mexicano Tacos & Burritos,"-12.1220962,-77.0310092,17z",5,"Excelente, súper recomendado"
El Mexicano Tacos & Burritos,"-12.1220962,-77.0310092,17z",1,Las chicas del local no saben tratar a su clientela. Hace 5 meses quise ir con mi sobrina y mi hijo y me trataron pésimo por no tener mi carnet de vacunación con las 3 dosis y no era un tema mío sino del Minsa
El Mexicano Tacos & Burritos,"-12.1220962,-77.0310092,17z",5,Muy buen sabor! Lugar agradable aunque pequeño para hacer barra libre
El Mexicano Tacos & Burritos,"-12.1220962,-77.0310092,17z",4,Comida muy rica!! Pero la atención de parte del personal no fue la más cordial según mi experiencia.
El Mexicano Tacos & Burritos,"-12.1220962,-77.0310092,17z",1,La atención es demasiado mala. Y tardan demasiado para entregarte un plato.
El Mexicano Tacos & Burritos,"-12.1220962,-77.0310092,17z",4,"La comida es muy buena!!, Cuidado con pedir los burritos muy grandes si van entre pocas personas!"
El Mexicano Tacos & Burritos,"-12.1220962,-77.0310092,17z",5,"La comida es en El Mexicano es demasiado rica!!! Órale que los precios no son tan caros y, dependiendo de lo que pidan, puede que demoren un poco en servir, sobre todo cuando se llena el restaurante. Pero créanme que vale la pena la espera.…"
El Mexicano Tacos & Burritos,"-12.1220962,-77.0310092,17z",4,Todo muy rico
El Mexicano Tacos & Burritos,"-12.1220962,-77.0310092,17z",5,"Excelente comida Mexicana, tienen la opción de pedir a la carta y tenedor libre donde puedes comer hasta que no puedas más...."
El Mexicano Tacos & Burritos,"-12.1220962,-77.0310092,17z",5,"Muy rico, sobre todo la quesadilllas!"
El Mexicano Tacos & Burritos,"-12.1220962,-77.0310092,17z",5,"Comida deliciosa,el agua de Jamaica heladita  exquisita, casi le saco la vuelta a mi chicha morada jeje ,el local de Miraflores pequeño pero muy acogedor,el trato del personal muy amable y servicial.Se los recomiendo."
El Mexicano Tacos & Burritos,"-12.1220962,-77.0310092,17z",4,"Buena comida y atención, lo malo es el tiempo de espera por el tamaño del local. Se vale repetir!"
El Mexicano Tacos & Burritos,"-12.1220962,-77.0310092,17z",1,"Fui a pedir para llevar, me hicieron esperar 50 minutos . Me dijeron que debía esperar la comida como si estuviera esperando una mesa."
El Mexicano Tacos & Burritos,"-12.1220962,-77.0310092,17z",4,El lugar es pequeño pero agradable. Tienen Muy ricos platos Mexicanos. Pedimos chilaquiles. Tacos y Sopes. Todos muy ricos. La atención fue muy buena 👌 👍🏼…
El Mexicano Tacos & Burritos,"-12.1220962,-77.0310092,17z",5,"Muy buen sitio de comida mexicana
Recomendada la chimichanga y los tacos pastor"
El Mexicano Tacos & Burritos,"-12.1220962,-77.0310092,17z",4,"Muy rico, buenas opciones. Un poquito dificil navegar en el menú, pero en general muy bueno y variado. Lastima no tenian carne de birria, la probaremos en otra ocasión. El alambre de carne al pastor estuvo delicioso!"
El Mexicano Tacos & Burritos,"-12.1220962,-77.0310092,17z",4,Si te gustan los sabores intensos esta bien este lugar
El Mexicano Tacos & Burritos,"-12.1220962,-77.0310092,17z",5,"Muy rica toda la comida, hay una barra libre x S/. 55 soles que incluye la mayoría de los platos y agua de Jamaica ilimitado. Solo que el local de Miraflores es más pequeño (Solo 5 mesas)"
El Mexicano Tacos & Burritos,"-12.1220962,-77.0310092,17z",5,Buenísimo. El local un poco pequeño pero acogedor. Los tacos increíbles. Definitivamente un lugar para regresar
El Mexicano Tacos & Burritos,"-12.1220962,-77.0310092,17z",4,"Tomar en cuenta que el local es muy pequeño así que muchas veces hay que esperar por la mesa.
Los tacos y los burritos, recomendados!"
El Mexicano Tacos & Burritos,"-12.1220962,-77.0310092,17z",5,"Lugar pequeño, por lo que hay cola para ingresar. La comida es exquisita por lo que la espera vale la pena."
El Mexicano Tacos & Burritos,"-12.1220962,-77.0310092,17z",5,"Pequeño restaurante, comida agradable...volveremos!"
El Mexicano Tacos & Burritos,"-12.1220962,-77.0310092,17z",5,"El personal siempre es atento con los clientes. La carta es bastante extensa pero me hubiese gustando que si tengan agua de horchata, solo pude pedir agua de jamaica.…"
El Mexicano Tacos & Burritos,"-12.1220962,-77.0310092,17z",4,"Buena atención y muy rico todo, aunque el local es pequeño. Vale la pena ir por su barra libre."
El Mexicano Tacos & Burritos,"-12.1220962,-77.0310092,17z",1,"Decepción total, el sabor no hera agradable, el guacamole estaba salado
Pedimos la barra libre para 3 personas, de todo los platos que pedimos ninguno nos agrado; la atención del mozo estuvo bien pero la atención de la señorita pésima(la que no usa uniforme y se viste de todo negro)."
El Mexicano Tacos & Burritos,"-12.1220962,-77.0310092,17z",1,"Muy mala experiencia, no volveré. Encontré una piedra en un taco, solución ha sido cobrarme igual el taco y la comida. Sin una disculpa concreta. No había Margarita ni bebida alcolica."
El Mexicano Tacos & Burritos,"-12.1220962,-77.0310092,17z",3,"Sitio agradable, calidad precio muy bien"
El Mexicano Tacos & Burritos,"-12.1220962,-77.0310092,17z",1,"Creo que a sido el peor restaurante que he ido en mi vida, fui un viernes por la noche al local de benavides, nos sentaron frente al baño (olía a orina horrible) pedimos que nos movieran y esperamos y nos pasamos a otra mesa, el pedido de…"
El Mexicano Tacos & Burritos,"-12.1220962,-77.0310092,17z",5,"Lo recomiendo, Buena atención, buena comida, buen ambiente. Mis favoritas fueron las gringas en longaniza."
El Mexicano Tacos & Burritos,"-12.1220962,-77.0310092,17z",5,Muy buena atención con todos los protocolos. Precios buenos y accesibles. La sazón es buenísima.
El Mexicano Tacos & Burritos,"-12.1220962,-77.0310092,17z",3,"Muy bueno, para picar de aqui y de alla... al mejor estilo mejicano"
El Mexicano Tacos & Burritos,"-12.1220962,-77.0310092,17z",3,"Para los amantes de la comida mexicana, la experiencia realmente no es nada novedosa, la comida no es espectacular, la atención es muy buena sin embargo, no poseen la carta completa debido a que tiene distintos locales. Además, los combos…"
El Mexicano Tacos & Burritos,"-12.1220962,-77.0310092,17z",5,"Variada selección de comidas, ofrecen tacos, enchiladas, chilaquiles, rubias, nachos, entre otras, y también con diversas cualidades de carnes para las comidas, entre las bebidas el agua de Jamaica es menester de probar como la barra libre. El ambiente a su vez es acogedor y entretenido. La atención al cliente A1"
El Mexicano Tacos & Burritos,"-12.1220962,-77.0310092,17z",1,Terrible las bebidas y los tacos al pastor no pasa nada
El Mexicano Tacos & Burritos,"-12.1220962,-77.0310092,17z",5,"Siendo mexicano debo decir que este lugar es bueno. El estilo de menu puede ser demasiado por que escoges combinaciones de carne con tipo de taco o tipo de platillo, lo que puede ser demasiado pero cumple con dar un sabor mexicano, sin ser autentico, pero aceptable. Pregunta por el buffete que incluye el agua de jamaica que quieras!"
El Mexicano Tacos & Burritos,"-12.1220962,-77.0310092,17z",5,Buen lugar hay una carne que no me gusto pero en si no es muy caro y eso si hay que ir en buen horario sino tienes que esperar
El Mexicano Tacos & Burritos,"-12.1220962,-77.0310092,17z",4,"El lugar es pequeño;pero colorido y lleno de sabor. Muy al estilo mexicano.
Los precios están regulares desde burritos de 25 soles y otros de 28  a 35soles, aunque puedes encontrar tacos a menos precios.…"
El Mexicano Tacos & Burritos,"-12.1220962,-77.0310092,17z",5,"Todos los platos muy bien servidos, muy buena atención... Totalmente recomendado!"
El Mexicano Tacos & Burritos,"-12.1220962,-77.0310092,17z",4,Todo muy delicioso!!!
El Mexicano Tacos & Burritos,"-12.1220962,-77.0310092,17z",5,"Muy bueno, los mejores Tacos en lima sin duda. Las tostadas al pastor son increíbles y muy buena atención."
El Mexicano Tacos & Burritos,"-12.1220962,-77.0310092,17z",5,Muy ricos y la atención magnífica
El Mexicano Tacos & Burritos,"-12.1220962,-77.0310092,17z",5,"Bonito lugar, algo pequeño pero acojedor, la comida buena con mucho sabor, salsas estupendas y atención buena."
El Mexicano Tacos & Burritos,"-12.1220962,-77.0310092,17z",5,Muy bueno y la atención ni que hablar! Recomendado
El Mexicano Tacos & Burritos,"-12.1220962,-77.0310092,17z",1,"Los pedí por delivery y estaba muy emocionada porque había leído buenas reseñas pero dios mío. Todo lo que pedí estaba PÉSIMO. Cada vez que probaba pensaba: ""bueno, quizás el pollo si está rico o los churros o el agua de jamaica"" al final…"
El Mexicano Tacos & Burritos,"-12.1220962,-77.0310092,17z",3,"pudo ser mejor, la barra libre no fue de mi completo agrado ya que la carne vino salada en algunos tacos, espacio muy reducido e incomodo y la demora en cada platillo aburría un poco."
El Mexicano Tacos & Burritos,"-12.1220962,-77.0310092,17z",4,"Comida tradicional mexicana, buen sabor y variada carta. Recomendable el all you cant eat para comer en grupo."
El Mexicano Tacos & Burritos,"-12.1220962,-77.0310092,17z",5,"Rica comidaaa pasas un rato agradable, la atención es muy buena, todo estuvo excelente"
El Mexicano Tacos & Burritos,"-12.1220962,-77.0310092,17z",5,"El lugar increíble ¡! La atención, el carisma del personal y gran ambiente del local te hace sentir en México, la comida muy buena y para lo que no tienen un paladar conocedor de la comida mexicana créanme que como mexicano les puedo decir…"
El Mexicano Tacos & Burritos,"-12.1220962,-77.0310092,17z",3,"Es bueno. Pero la atencion es regular a baja, y ponen condiciones para el barra libre muy extremas."
El Mexicano Tacos & Burritos,"-12.1220962,-77.0310092,17z",5,"Buenísimo en sabor, precio y atención 💕…"
El Mexicano Tacos & Burritos,"-12.1220962,-77.0310092,17z",5,"Muy rica la comida, la carne longaniza fue mi preferida y los chilaquiles super recomendados. Tuve un descuido y olvide mi cartera en el local, el personal fue muy amable y atento al darle solución."
El Mexicano Tacos & Burritos,"-12.1220962,-77.0310092,17z",4,"Este es el lugar en Perú cuya comida tiene el sabor más cercano a la que uno come en México. El buffet tiene un buen precio y el agua de jamaica es ilimitada. El local de Miraflores es algo pequeño, así que si vas a ir un fin de semana, anda desde temprano."
El Mexicano Tacos & Burritos,"-12.1220962,-77.0310092,17z",3,"Estuvo bien la barra libre, aunque no da chance de comer mucho porque llena bastante, el local es el punto débil, bastante pequeño."
El Mexicano Tacos & Burritos,"-12.1220962,-77.0310092,17z",1,No me gustó el sabor. Y la cantidad es mínima por 9soles. (El relleno tendrá sus 6-8cm de diámetro ver foto)
El Mexicano Tacos & Burritos,"-12.1220962,-77.0310092,17z",1,Fuimos mi pareja y yo a cenar  después de ver los buenos comentarios que tenía pero al llegar ahí nos llevamos la peor experiencia que uno puede tener pedimos un mix de tacos que tenían un sabor extraño y no lo comimos y se lo comentamos al…
El Mexicano Tacos & Burritos,"-12.1220962,-77.0310092,17z",5,"Pequeño lugar pero acogedor, super la atención, si se tiene que ir medio temprano para poder ingresar rapido o sino da la facilidad de reservar un mesa, amplia variedad de comida mexicana, lo mejor es la barra libre( 60soles) y el aguita de jamaica que es genial, uno de nuestros lugares favoritos con mi novia"
El Mexicano Tacos & Burritos,"-12.1220962,-77.0310092,17z",5,Muy rico en especial los chilaqhiles
El Mexicano Tacos & Burritos,"-12.1220962,-77.0310092,17z",1,"Pésima atención, tiempo de espera es demasiado , la comida no es nada regional, a los 10 minutos de haber pedido nos dijeron que el agua de jamaica se había acabado"
El Mexicano Tacos & Burritos,"-12.1220962,-77.0310092,17z",4,"Comida de muy buen sabor, buena presentación y generosa. Además, la atención del personal es amable. Sin embargo, el local de miraflores es estrecho y se queda chico los fines de semana y por ello también suelen demorarse de más en traer los platos."
El Mexicano Tacos & Burritos,"-12.1220962,-77.0310092,17z",3,"Quise pedir un trio de tacos y me dijeron que debían ser del mismo sabor (entonces cual es la gracia de pedir 3?), y la verdadel sabor solo regular del taco al pastor y la tortilla de maiz no se sentía fresca"
El Mexicano Tacos & Burritos,"-12.1220962,-77.0310092,17z",5,"Dieron opción de probar un trago antes de pedirlo. Sólo por eso 5 estrellas.
Tacos ricos. Lamentablemente demoraron media hora en servir así que lleva algo para entretenerte"
El Mexicano Tacos & Burritos,"-12.1220962,-77.0310092,17z",4,Comida agradable. No permite reservas por lo que en determinadas horas no hay espacio suficiente. El lugar es pequeño pero acogedor. La atención rápida y el personal de servicios muy amable. Algo que mejorar es el picante. Pedimos en…
El Mexicano Tacos & Burritos,"-12.1220962,-77.0310092,17z",4,El jugo de jamaica ilimitado es exquisito y la comida tiene buen gusto. Deberian tener un espacio más grande ya que casi nunca hay lugar y hay que hacer fila afuera
El Mexicano Tacos & Burritos,"-12.1220962,-77.0310092,17z",5,"Buenísimo, el sabor y las bebidas con auténtico sabor mexicano. Recomendado"
El Mexicano Tacos & Burritos,"-12.1220962,-77.0310092,17z",5,Muy rico
El Mexicano Tacos & Burritos,"-12.1220962,-77.0310092,17z",5,"El lugar es pequeño pero muy simpático, la vida es buena."
El Mexicano Tacos & Burritos,"-12.1220962,-77.0310092,17z",2,"La comida estuvo bien. Pero el tiempo de espera fue fatal. Fuimos al local de Miraflores y nos dijeron que el tiempo de espera era de tres a más horas, así que nos recomendaron ir al local de Benavides, porque el tiempo sería menor.…"
El Mexicano Tacos & Burritos,"-12.1220962,-77.0310092,17z",4,"Me gustó la comida, sabrosa gustosa muy variada"
El Mexicano Tacos & Burritos,"-12.1220962,-77.0310092,17z",1,"El personal es muy amable pero tienen cero criterio para administrar los tiempos de espera.
Puedes estar casi 2 horas en lista esperando.…"
El Mexicano Tacos & Burritos,"-12.1220962,-77.0310092,17z",5,"Bonito lugar, la mejor opción es la barra libre y tanto la música como el ambiente te ofrecen una experiencia muy mexicana!! Las aguas y los platos son muy agradables. A unos cuantos metros se encuentra una cochera muy segura, ideal si van con auto!!"
El Mexicano Tacos & Burritos,"-12.1220962,-77.0310092,17z",3,Deli! La chicha a la mexicana es deliciosa!! Y los burritos re gorditos!!  Sabes que me falto? Que vendieran Margaritas!!!!
El Mexicano Tacos & Burritos,"-12.1220962,-77.0310092,17z",5,"Excelente, buena comida y atención muy cordial. Recomendado!"
El Mexicano Tacos & Burritos,"-12.1220962,-77.0310092,17z",4,Muy buena opción para comida mexicana a precio razonable.
El Mexicano Tacos & Burritos,"-12.1220962,-77.0310092,17z",4,"El sabor excelente!, la propuesta es muy buena del refil, sin embargo tienen meseros muy intensas, que para mi gusto esta demás que se anden acercando tanto a los clientes, esta bien 1 vez pero no a cada rato!. Igual deberían abrir un local mas grande!. Y preparar mas pico de gallo! Q las 3 veces q fui nunca hay!"
El Mexicano Tacos & Burritos,"-12.1220962,-77.0310092,17z",1,"La atención verdaderamente es pésima, tanto la chica de la linea telefónica para delivery, corta la llamada, no da información, como el joven de recepción habla de manera hostil, ponen mil trabas y chotea a los clientes. En cuanto a oa comida esperaba más, por las fotos de instagram tenia altas expectativas que no se cumplieron."
El Mexicano Tacos & Burritos,"-12.1220962,-77.0310092,17z",4,"Comida exelente
Atención muy buena
Pero es comida mexicana y no hay ninguna bebida alcohólica no creas que vas a encontrar tequila mucho menos un mezcal."
El Mexicano Tacos & Burritos,"-12.1220962,-77.0310092,17z",5,"La comida excelente, las enchiladas lo máximo"
El Mexicano Tacos & Burritos,"-12.1220962,-77.0310092,17z",5,Buena atención buena comida y buen ambiente
El Mexicano Tacos & Burritos,"-12.1220962,-77.0310092,17z",4,"Buen lugar de paso para cenar y disfrutar la música mexicana.
El sabor similar al mexicano.…"
El Mexicano Tacos & Burritos,"-12.1220962,-77.0310092,17z",3,"El El lugar es muy pequeño y un poco desordenado en el momento del pedido, quizá es por la falta de espacio... sólo habrán 6 mesas, a lo mucho.
Los platos son buenos, pero no es recomendable porque tiene demasiado aderezo.…"
El Mexicano Tacos & Burritos,"-12.1220962,-77.0310092,17z",5,"En ambiente es bueno, la atención es rapida, la infraestructura es pequeña y de poco aforo. El baño esta mal ubicado.
La comida es buena y tienen todos los niveles de picante, si quieres ir por ""all…"
El Mexicano Tacos & Burritos,"-12.1220962,-77.0310092,17z",5,Buen ambiente y cómoda muuuuy buena
El Mexicano Tacos & Burritos,"-12.1220962,-77.0310092,17z",1,Pésima atención al cliente. No hay protocolos de bioseguridad. Los tacos a penas tienen carne y las tortillas las entregan frías. El precio no compensa la calidad y sabor.
El Mexicano Tacos & Burritos,"-12.1220962,-77.0310092,17z",5,Muchos restaurantes mexicanos se hacen llamar así y en realidad no lo son pero este lugar superó todas mis expectativas y eso que trabajan un grupo de jóvenes peruanos y venezolanos ningún solo mexicano las tortillas son muy buenas la…
El Mexicano Tacos & Burritos,"-12.1220962,-77.0310092,17z",3,"Vale la pena la barra libre, a la carta no vale la pena, no tiene estacionamiento y el local es demasiado pequeño."
El Mexicano Tacos & Burritos,"-12.1220962,-77.0310092,17z",4,"La comida muy rica pero la atención no es tan buena. No explican la dinámica del all You can eat, ni especifican que carnes hay. El local de Miraflores es pequeño. Los baños cuentan con todo lo necesario y la decoración es alucinante."
El Mexicano Tacos & Burritos,"-12.1220962,-77.0310092,17z",5,La comida es bastante sabrosa. Tienen varios tipos de carne y salsas para elegir. Los tacos están entre 9 a 12 soles dependiendo del tipo de tortilla. Los burritos desde 20 soles. Hay un menú de 16 soles hasta la 1pm. La Barra libre cuesta…
El Mexicano Tacos & Burritos,"-12.1220962,-77.0310092,17z",4,"Pedí quesadillas y estaban muy buenas, pero las flautas no me parecieron ricas, muy poco relleno y solo se sentía el sabor a tortilla frita. El lugar es muy pequeño e incómodo, mucho ruido, no se puede conversar y encima el día que fui…"
El Mexicano Tacos & Burritos,"-12.1220962,-77.0310092,17z",1,"La sede de Miraflores no ofrece alcohol, deberían indicar que no todas las sedes tienen la misma carta. No hubo micheladas por eso le doy una estrella."
El Mexicano Tacos & Burritos,"-12.1220962,-77.0310092,17z",1,Terrible experiencia en este local. Pedí el plato de alambre de 4 unidades x 30 soles sabor pollo. Me trajeron una sopa de queso cebolla y pollo mal trozado (varios trozos de cartilago). Si el plato costara 12 soles lo entendería pero por…
El Mexicano Tacos & Burritos,"-12.1220962,-77.0310092,17z",3,"El personal es súper amablr, sobretodo para explicar el sistema de barra libre. La cocina es rápida para preparar la comida. No hay bebidas alcohólicas pero hay varias opciones sun alcohol. Las porciones son generosas. El local no es muy…"
El Mexicano Tacos & Burritos,"-12.1220962,-77.0310092,17z",5,"Pase el día con mi familia en este restaurante y fue espectacular, fuimos muy emocionados por el all you can eat, el local estaba a reventar, sin embargo una señorita nos recibió en la puerta nos invitaron nachos en la espera y en menos de…"
El Mexicano Tacos & Burritos,"-12.1220962,-77.0310092,17z",1,"Mi amigo y yo fuimos a comer pedimos tacos y la troca, a los 15 min de haber comido los Platos nos comenzamos a sentir mal, tuvimos q irnos a la media hora de llegar ya que nos sentíamos mal (a nivel gástrico!). Estuvimos mal durante 3 días más, tuvimos una intoxicación por la carne. Esperamos haber sido los únicos con ese malestar :("
El Mexicano Tacos & Burritos,"-12.1220962,-77.0310092,17z",4,"El local es agradable, la atención es buen ya que el personal del restaurante se preocupa por tu comodidad. Respecto a la comida vale decir que tienen platos a la carta y la opción de elegir buffet, en mi opinión el buffet vale la pena más…"
El Mexicano Tacos & Burritos,"-12.1220962,-77.0310092,17z",5,"Probé todo menos los burritos, pero todo estaba rico rico . Lo recomiendo la Jamaica estaba DE LI CI O SA❤️🤩…"
El Mexicano Tacos & Burritos,"-12.1220962,-77.0310092,17z",4,"Es un establecimiento pequeño, la zona donde se encuentra es tranquila. En ciertas horas de la noche no hay mesas libres. Tiene la opción de ""all you can eat"" y cuesta 45 soles y puede pedirse cualquier plato de la carta, además incluye…"
El Mexicano Tacos & Burritos,"-12.1220962,-77.0310092,17z",3,"Lugar agradable, y la comida es bastante buena. Sin embargo el local es muy reducido, no había jabón en el baño (lo cual es un must en un restaurant de tacos) cuando fui ya se habían acabado varias carnes muy representativas (como la carne…"
El Mexicano Tacos & Burritos,"-12.1220962,-77.0310092,17z",3,"La verdad que no tiene nada de especial. Comí unos burritos, el frejoo seco, el arroz seco. No me gustó, he probado muchos mejores. Antes, cuando era Nacho Tequila tenía un sabor buenísimo, creo q es porque ya no le ponen una salsa que antes usaban. Una pena porque es el mismo dueño y chef de Nacho Tequila"
El Mexicano Tacos & Burritos,"-12.1220962,-77.0310092,17z",2,"La atención es muy buena pero a veces llega a ser incomodo porque te  observan mucho mientras comes. La salsas picantes no picaban absolutamente nada, le reclamamos al mesero y dijo que era error de producción. Los tacos vienen con poca…"
El Mexicano Tacos & Burritos,"-12.1220962,-77.0310092,17z",3,"La barra libre sólo es recomendable para quienes no se hastíen con facilidad. Tardan demasiado en traer los pedidos y eso te quita el hambre, estuvimos casi 2h y sólo pudimos pedir 2 rondas porque no llegaban. Deberían tener más bebidas en la barra libre porque no a todos les gusta la jamaica."
El Mexicano Tacos & Burritos,"-12.1220962,-77.0310092,17z",4,"Amabilidad, muchos productos, pero le falta para sentir la sazón mexicana."
El Mexicano Tacos & Burritos,"-12.1220962,-77.0310092,17z",1,"Lugar relativamente pequeño, la comida estuvo buena; sin embargo, se tardaron demasiado en traer un pedido al punto en que el resto ya había acabado. A parte de eso, agregaron demasiados pedidos a la boleta que no se habían realizado, aumentando el precio final. No volvería a ir."
El Mexicano Tacos & Burritos,"-12.1220962,-77.0310092,17z",5,"Excelente comida. Me impresionó lo frescos que se sienten los insumos y además, la comida en sí no está muy condimentada pero se siente bien sabrosa.
En relación precio calidad pienso que merece las cinco estrellas.
En la foto, el burrito con carne al pastor, buenazo!!"
El Mexicano Tacos & Burritos,"-12.1220962,-77.0310092,17z",5,"Excelente lugar, muy acogedor. Excelente comida, me encanto!! como en México! Recomendadiísimo!!"
El Mexicano Tacos & Burritos,"-12.1220962,-77.0310092,17z",3,"Sólido 3. Habiendo radicado años en México y conocedora de la gastronomía mexicana al asistir a degustar, comprobamos que el sabor dista mucho del sabor mexicano. Sin embargo, para salir se la rutina, está bien. Debe ser como probar un…"
El Mexicano Tacos & Burritos,"-12.1220962,-77.0310092,17z",5,Me recordo mucho a mi viaje a mexico en el 2019
El Mexicano Tacos & Burritos,"-12.1220962,-77.0310092,17z",5,"Delicioso, buen sabor típico mexicano y excelente atención"
